aw_deep_link,product_name,aw_product_id,merchant_product_id,merchant_image_url,description,merchant_category,search_price,merchant_name,merchant_id,category_name,category_id,aw_image_url,currency,store_price,delivery_cost,merchant_deep_link,language,last_updated,display_price,data_feed_id
https://www.awin1.com/pclick.php?p=44865574208&a=2914133&m=10990,"Norwegen - Nordkap - Kreuzfahrt mit einem Postschiff der Havila Flotte ab/an Bergen",44865574208,8a0092ff9757ce9701975935ae071022,https://d13d0f5of5vzfo.cloudfront.net/images/products/8a0092ff9757ce9701975935ae071022/large_8a0092ff9d84cede019d86088b83453a-Havila-Pollux-Hjrundfjord.jpg,"In Bergen gehen Sie an Bord der modernen Postschiffe Havila Capella, Havila Castor, Havila Polaris oder Havila Pollux. Tauchen Sie ein in die atemberaubende Landschaft Norwegens und fahren Sie bis zum legendären Nordkap, wo im Sommer die Sonne nie untergeht und im Winter die Nordlichter den Himmel in faszinierenden Farben erleuchten. Ein einzigartiges Abenteuer erwartet Sie!",,1999.00,"Berge & Meer",10990,,,https://images2.productserve.com/?w=200&h=200&bg=white&trim=5&t=letterbox&url=ssl%3Ad13d0f5of5vzfo.cloudfront.net%2Fimages%2Fproducts%2F8a0092ff9757ce9701975935ae071022%2Flarge_8a0092ff9d84cede019d86088b83453a-Havila-Pollux-Hjrundfjord.jpg&feedId=115640&k=33e577739f4fc0ea045f17d6d06b2fab6377c54a,EUR,,,https://www.berge-meer.de/angebote/norwegen-nordkap-kreuzfahrt-mit-einem-postschiff-der-havila-flotte-ab-an-bergen,,,EUR1999.00,115640
https://www.awin1.com/pclick.php?p=44865574210&a=2914133&m=10990,"Großbritannien/Irland - Kreuzfahrt mit MSC Preziosa ab/an Hamburg",44865574210,8a0092ff970a8f0a01970bf68d923c7a,https://d13d0f5of5vzfo.cloudfront.net/images/products/8a0092ff970a8f0a01970bf68d923c7a/large_8a0092ff9264f19b019265b25e0861e4-Schottland-Edinburgh-Skyline.jpg,"Erleben Sie mit der MSC Preziosa die Vielfalt der Britischen Inseln! Entdecken Sie Belfast und Greenock, staunen Sie über die raue Schönheit der Orkney Inseln und genießen Sie unvergessliche Küstenlandschaften. Außerdem haben Sie die Wahl: Erkunden Sie Irland mit den charmanten Städten Cork und Dún Laoghaire oder entdecken Sie Edinburgh, Liverpool und die wilde Schönheit der Isle of Lewis.",,1739.00,"Berge & Meer",10990,,,https://images2.productserve.com/?w=200&h=200&bg=white&trim=5&t=letterbox&url=ssl%3Ad13d0f5of5vzfo.cloudfront.net%2Fimages%2Fproducts%2F8a0092ff970a8f0a01970bf68d923c7a%2Flarge_8a0092ff9264f19b019265b25e0861e4-Schottland-Edinburgh-Skyline.jpg&feedId=115640&k=a79f0bb85e7d11c9e91bec26b0b82053dd88b7b4,EUR,,,https://www.berge-meer.de/angebote/grossbritannien-irland-kreuzfahrt-mit-der-msc-preziosa-ab-an-hamburg-2,,,EUR1739.00,115640
https://www.awin1.com/pclick.php?p=44865574211&a=2914133&m=10990,"Weltkreuzfahrt - mit MSC Magnifica ab/an Genua",44865574211,8a0092ff95406f92019542af5c901a2e,https://d13d0f5of5vzfo.cloudfront.net/images/products/8a0092ff95406f92019542af5c901a2e/large_8a0092ff85c835310185c98e38985ccd-Australien-Sydney.JPG,"In 122 Tagen um die Welt mit MSC Magnifica: Ab Genua erleben Sie Küsten in Europa, traumhafte Inseln rund um den Globus, fremde Kulturen in Mittel- und Südamerika, Paradiese in der Südsee und Karibik, Großstädte in den USA, Sehnsuchtsziele auf Hawaii sowie ferne Orte in Australien und Neuseeland. An den Seetagen genießen Sie die vorbeiziehenden Landschaften unseres Planeten und entspannen an Bord.",,16999.00,"Berge & Meer",10990,,,https://images2.productserve.com/?w=200&h=200&bg=white&trim=5&t=letterbox&url=ssl%3Ad13d0f5of5vzfo.cloudfront.net%2Fimages%2Fproducts%2F8a0092ff95406f92019542af5c901a2e%2Flarge_8a0092ff85c835310185c98e38985ccd-Australien-Sydney.JPG&feedId=115640&k=ff77e1d563d5419ff917430c7109f7686f016e0f,EUR,,,https://www.berge-meer.de/angebote/weltkreuzfahrt-mit-msc-musica-ab-an-genua,,,EUR16999.00,115640
https://www.awin1.com/pclick.php?p=44865574212&a=2914133&m=10990,"Alaska & Kanada - Kreuzfahrt mit der Celebrity Summit von Seward bis Vancouver inkl. Alaska- & Kanada-Rundreise",44865574212,8a0092ff9622d0700196249af8d03ffb,https://d13d0f5of5vzfo.cloudfront.net/images/products/8a0092ff9622d0700196249af8d03ffb/large_8a0092ff6ab43cfe016ab57bffc154a8-Seward.jpg,"Erleben Sie die Wildnis Alaskas und Kanadas auf einer einzigartigen Rundreise. Von Anchorage über den Denali Nationalpark bis nach Dawson City und in den Yukon erwarten Sie spektakuläre, vielfältige Landschaften. Danach genießen Sie mit der Celebrity Summit eine Alaska-Kreuzfahrt entlang der Inside Passage mit Stopps in Juneau, Skagway und Ketchikan - ein Abenteuer durch Eisfelder und Fjorde!",,6799.00,"Berge & Meer",10990,,,https://images2.productserve.com/?w=200&h=200&bg=white&trim=5&t=letterbox&url=ssl%3Ad13d0f5of5vzfo.cloudfront.net%2Fimages%2Fproducts%2F8a0092ff9622d0700196249af8d03ffb%2Flarge_8a0092ff6ab43cfe016ab57bffc154a8-Seward.jpg&feedId=115640&k=d90b22fb5d138f73472e52e231e9d35ae3dd328f,EUR,,,https://www.berge-meer.de/angebote/alaska-kanada-rundreise-von-anchorage-bis-seward-kreuzfahrt-mit-der-celebrity-summit-bis-vancouver,,,EUR6799.00,115640
https://www.awin1.com/pclick.php?p=44865574201&a=2914133&m=10990,"Südamerika & Antarktis - Kreuzfahrt mit Oosterdam von Santiago de Chile bis Buenos Aires",44865574201,8a0092ff9ab40bb3019ab4ffa86a0906,https://d13d0f5of5vzfo.cloudfront.net/images/products/8a0092ff9ab40bb3019ab4ffa86a0906/large_8a0092ff98abb22b0198ad2738c52222-Chile--Santiago-de-Chile.jpg,"Erleben Sie große Expeditionsgefühle mit Komfort: An Bord der Oosterdam reisen Sie zwischen Santiago de Chile und Buenos Aires, rund um das legendäre Kap Hoorn bis in die Antarktis - eine Welt aus Eisbergen, Pinguinen und stiller Majestät. Chilenische Fjorde, Ushuaia, die Falklandinseln & mehr erwarten Sie.",,4999.00,"Berge & Meer",10990,,,https://images2.productserve.com/?w=200&h=200&bg=white&trim=5&t=letterbox&url=ssl%3Ad13d0f5of5vzfo.cloudfront.net%2Fimages%2Fproducts%2F8a0092ff9ab40bb3019ab4ffa86a0906%2Flarge_8a0092ff98abb22b0198ad2738c52222-Chile--Santiago-de-Chile.jpg&feedId=115640&k=2edcf0c7ad83db917d165222bac330b728521d8f,EUR,,,https://www.berge-meer.de/angebote/suedamerika-antarktis-kreuzfahrt-mit-oosterdam-ab-santiago-de-chile-an-buenos-aires,,,EUR4999.00,115640
https://www.awin1.com/pclick.php?p=44865574213&a=2914133&m=10990,"Südamerika - Kreuzfahrt mit Oosterdam von Santiago de Chile bis Buenos Aires inkl. Peru- & Brasilien-Rundreise",44865574213,8a0092ff9c2bfbe0019c2c99da6d065d,https://d13d0f5of5vzfo.cloudfront.net/images/products/8a0092ff9c2bfbe0019c2c99da6d065d/large_8a0092ff6c1cba9d016c2e620421352a-Machu-Picchu-Peru.jpg,"Das ist Südamerika pur: Ihre Reise beginnt mit einer Rundreise durch Peru inklusive Machu Picchu. Anschließend startet in Santiago de Chile die Kreuzfahrt mit der Oosterdam rund um Kap Hoorn mit Fjorden, Eislandschaften sowie Besuchen in Feuerland, auf den Falklandinseln und in Montevideo bis nach Buenos Aires. Den Abschluss bildet eine Brasilien-Rundreise mit den Iguazú-Wasserfällen.",,7799.00,"Berge & Meer",10990,,,https://images2.productserve.com/?w=200&h=200&bg=white&trim=5&t=letterbox&url=ssl%3Ad13d0f5of5vzfo.cloudfront.net%2Fimages%2Fproducts%2F8a0092ff9c2bfbe0019c2c99da6d065d%2Flarge_8a0092ff6c1cba9d016c2e620421352a-Machu-Picchu-Peru.jpg&feedId=115640&k=eba7418bd16e69edf4c2c2eee944252fc4296a4f,EUR,,,https://www.berge-meer.de/angebote/suedamerika-kreuzfahrt-mit-oosterdam-ab-santiago-de-chile-an-buenos-aires-inkl-peru-brasilien-rundreise-2,,,EUR7799.00,115640
https://www.awin1.com/pclick.php?p=44865574214&a=2914133&m=10990,"Transafrika - Kreuzfahrt mit der MSC Armonia von Venedig bis Durban inkl. Südafrika-Rundreise",44865574214,8a0092ff9c2bfbe0019c2d6227a2208d,https://d13d0f5of5vzfo.cloudfront.net/images/products/8a0092ff9c2bfbe0019c2d6227a2208d/large_8a0092ff90b981d10190bbc8c63018a9-Nosy-Be-Madagaskar-Afrika.jpg,"Erleben Sie die Tierwelt Afrikas, Traumziele im Indischen Ozean und mediterranes Flair am Mittelmeer: Mit der MSC Armonia entdecken Sie ab Venedig (Marghera) exotische Ziele wie Südafrika, Mauritius, Madagaskar, die Seychellen, Jordanien, Ägypten und Griechenland. In Durban erwartet Sie afrikanisches Großstadtfeeling, bevor Sie sich auf eine Südafrika-Rundreise mit dem Krüger Nationalpark begeben.",,3449.00,"Berge & Meer",10990,,,https://images2.productserve.com/?w=200&h=200&bg=white&trim=5&t=letterbox&url=ssl%3Ad13d0f5of5vzfo.cloudfront.net%2Fimages%2Fproducts%2F8a0092ff9c2bfbe0019c2d6227a2208d%2Flarge_8a0092ff90b981d10190bbc8c63018a9-Nosy-Be-Madagaskar-Afrika.jpg&feedId=115640&k=1773e97ed20c0f22318c6e9b15031cab5ed18e19,EUR,,,https://www.berge-meer.de/angebote/transafrika-kreuzfahrt-von-venedig-bis-durban-inkl-suedafrika-rundreise-2,,,EUR3449.00,115640
https://www.awin1.com/pclick.php?p=44865574215&a=2914133&m=10990,"Alaska & Kanada - Kreuzfahrt mit der Celebrity Solstice von Seward bis Vancouver inkl. Alaska- & Kanada-Rundreise",44865574215,8a0092ff9cacbad7019caf065028523b,https://d13d0f5of5vzfo.cloudfront.net/images/products/8a0092ff9cacbad7019caf065028523b/large_8a0092ff6ab43cfe016ab583999441da-Mount-Kinley-Denali.jpg,"Entdecken Sie Alaska und Kanadas Yukon: Von Anchorage durch den Denali Nationalpark über Fairbanks bis nach Dawson City erleben Sie weite Wildnis, Goldrauschgeschichte und spektakuläre Panoramen. Über Skagway, Haines Junction und Valdez erreichen Sie Seward, von wo aus es mit der Celebrity Solstice durch die Inside Passage mit Gletschern, Fjorden und Stopps in Juneau, Skagway und Ketchikan geht.",,7699.00,"Berge & Meer",10990,,,https://images2.productserve.com/?w=200&h=200&bg=white&trim=5&t=letterbox&url=ssl%3Ad13d0f5of5vzfo.cloudfront.net%2Fimages%2Fproducts%2F8a0092ff9cacbad7019caf065028523b%2Flarge_8a0092ff6ab43cfe016ab583999441da-Mount-Kinley-Denali.jpg&feedId=115640&k=ceb16e26796e58560c3e6fa66763ae7280515085,EUR,,,https://www.berge-meer.de/angebote/alaska-kanada-kreuzfahrt-mit-der-celebrity-solstice-von-seward-bis-vancouver-inkl-alaska-kanada-rundreise,,,EUR7699.00,115640
https://www.awin1.com/pclick.php?p=44865574216&a=2914133&m=10990,"Südostasien - Kreuzfahrt mit AIDAstella ab/an Bangkok inkl. Badeaufenthalt in Pattaya",44865574216,8a0092ff9cbc2de0019cbd7057615877,https://d13d0f5of5vzfo.cloudfront.net/images/products/8a0092ff9cbc2de0019cbd7057615877/large_8a0092ff6e844399016eaccce82a60d0-Phuket-Phromthep-Cape.jpg,"Erleben Sie mit AIDAstella die faszinierende Natur und Kultur Südostasiens: Traumstrände auf Ko Samui und Phuket, exotische Metropolen wie Kuala Lumpur und Singapur, das grüne Langkawi sowie die vielfältige Insel Penang. Nach dieser Kreuzfahrt durch Thailand, Malaysia und Singapur erwartet Sie außerdem pure Erholung: Sie genießen entspannte Tage bei einem Badeaufenthalt in Pattaya.",,3999.00,"Berge & Meer",10990,,,https://images2.productserve.com/?w=200&h=200&bg=white&trim=5&t=letterbox&url=ssl%3Ad13d0f5of5vzfo.cloudfront.net%2Fimages%2Fproducts%2F8a0092ff9cbc2de0019cbd7057615877%2Flarge_8a0092ff6e844399016eaccce82a60d0-Phuket-Phromthep-Cape.jpg&feedId=115640&k=996589d1128113e647a9cd7b1e596ccbb8cd1851,EUR,,,https://www.berge-meer.de/angebote/suedostasien-kreuzfahrt-mit-aidastella-ab-an-bangkok-inkl-badeaufenthalt-in-pattaya-2,,,EUR3999.00,115640
https://www.awin1.com/pclick.php?p=44865574217&a=2914133&m=10990,"USA, Karibik & Südamerika - Kreuzfahrt mit der MSC Poesia ab/an Miami",44865574217,8a0092ff9cd0c728019cd319aa012bb6,https://d13d0f5of5vzfo.cloudfront.net/images/products/8a0092ff9cd0c728019cd319aa012bb6/large_8a0092ff90bea8370190bf6c24c74365-Strand-Palmen-Paar.jpg,"Vor Ihrer Traumkreuzfahrt genießen Sie eine Nacht in Miami. Dort starten Sie mit der MSC Poesia in die paradiesische Karibik. Vier abwechslungsreiche Routen stehen Ihnen zur Wahl, genießen Sie 24 Tage karibisches Flair. Freuen Sie sich auf weiße Strände in Aruba und Curaçao, tropische Natur in Jamaika, koloniales Flair in Cartagena oder exotische Eindrücke in Belize und Costa Rica.",,3199.00,"Berge & Meer",10990,,,https://images2.productserve.com/?w=200&h=200&bg=white&trim=5&t=letterbox&url=ssl%3Ad13d0f5of5vzfo.cloudfront.net%2Fimages%2Fproducts%2F8a0092ff9cd0c728019cd319aa012bb6%2Flarge_8a0092ff90bea8370190bf6c24c74365-Strand-Palmen-Paar.jpg&feedId=115640&k=f472838af4fc0351c3f611c8868639beaf33f90b,EUR,,,https://www.berge-meer.de/angebote/usa-karibik-suedamerika-kreuzfahrt-mit-der-msc-poesia-ab-an-miami,,,EUR3199.00,115640
https://www.awin1.com/pclick.php?p=44865574218&a=2914133&m=10990,"Australien & Südsee - Kreuzfahrt mit der Grand Princess ab/an Sydney",44865574218,8a0092ff9d1e06ad019d20afe1367c6e,https://d13d0f5of5vzfo.cloudfront.net/images/products/8a0092ff9d1e06ad019d20afe1367c6e/large_8a0092ff697210fb0169780b9363401c-Neukaledonien-Frankreich.jpg,"Das pulsierende Sydney und die Trauminseln im Südpazifik: Starten Sie mit zwei Nächten in Australiens Metropole vor Ihrer Kreuzfahrt. Freuen Sie sich dann auf Fidschi mit Lautoka, der Hauptstadt Suva und Dravuni Island, Mystery Island im exotischen Vanuatu und Nouméa in Neukaledonien. Zwischen türkisblauem Meer, weißen Stränden und kultureller Vielfalt erholen Sie sich an Bord der Grand Princess.",,3699.00,"Berge & Meer",10990,,,https://images2.productserve.com/?w=200&h=200&bg=white&trim=5&t=letterbox&url=ssl%3Ad13d0f5of5vzfo.cloudfront.net%2Fimages%2Fproducts%2F8a0092ff9d1e06ad019d20afe1367c6e%2Flarge_8a0092ff697210fb0169780b9363401c-Neukaledonien-Frankreich.jpg&feedId=115640&k=c5ca82588411c516d8f894b6f84058c14ecb87a3,EUR,,,https://www.berge-meer.de/angebote/australien-suedsee-kreuzfahrt-mit-der-grand-princess-ab-an-sydney,,,EUR3699.00,115640
https://www.awin1.com/pclick.php?p=44865574219&a=2914133&m=10990,"Östliches Mittelmeer - Kreuzfahrt mit der MSC Orchestra ab/an Istanbul inkl. Kappadokien-Rundreise",44865574219,8a0092ff9d470291019d488b3bf11817,https://d13d0f5of5vzfo.cloudfront.net/images/products/8a0092ff9d470291019d488b3bf11817/large_8a0092ff95a76ebc0195a8d0352709ae-Tuerkei-Istanbul-Tee-.jpg,"Ihre Reise beginnt mit einer Nacht in Istanbul, wo Orient und Okzident am Bosporus miteinander verschmelzen. Auf der anschließenden Kreuzfahrt erleben Sie historische Höhepunkte wie Korfu, Bari, Piräus/Athen und Izmir. Danach entdecken Sie auf einer eindrucksvollen Rundreise die faszinierenden Landschaften und Kulturschätze der Türkei - von den Feenkaminen Kappadokiens bis zur Küste bei Antalya.",,1489.00,"Berge & Meer",10990,,,https://images2.productserve.com/?w=200&h=200&bg=white&trim=5&t=letterbox&url=ssl%3Ad13d0f5of5vzfo.cloudfront.net%2Fimages%2Fproducts%2F8a0092ff9d470291019d488b3bf11817%2Flarge_8a0092ff95a76ebc0195a8d0352709ae-Tuerkei-Istanbul-Tee-.jpg&feedId=115640&k=7e78756dbdec9f6d15df196c1b0ecf2bcaf5e825,EUR,,,https://www.berge-meer.de/angebote/oestliches-mittelmeer-kreuzfahrt-mit-der-msc-orchestra-inkl-kappadokien-rundreise,,,EUR1489.00,115640
https://www.awin1.com/pclick.php?p=44865574220&a=2914133&m=10990,"Island, Grönland & Schottland - Kreuzfahrt mit MS Hamburg von Kangerlussuaq bis Hamburg",44865574220,8a0092ff9d4c2863019d4dae546b1590,https://d13d0f5of5vzfo.cloudfront.net/images/products/8a0092ff9d4c2863019d4dae546b1590/large_8a0092ff8e0ccafa018e0e9af50801ef-Groenland-Ilulissat-Buckelwale.jpg,"Erleben Sie mit MS Hamburg die Naturwunder zwischen der Arktis und Europa und genießen Sie den Nordatlantik vom grönländischen Kangerlussuaq über die schottischen Orkney Inseln bis nach Hamburg. Entdecken Sie die Diskobucht, Orte wie Sisimiut und Nuuk sowie die Passage des Prins Christian Sunds. Islands Fjordlandschaften und Städte wie Reykjavík und Akureyri werden Sie gleichermaßen begeistern.",,4399.00,"Berge & Meer",10990,,,https://images2.productserve.com/?w=200&h=200&bg=white&trim=5&t=letterbox&url=ssl%3Ad13d0f5of5vzfo.cloudfront.net%2Fimages%2Fproducts%2F8a0092ff9d4c2863019d4dae546b1590%2Flarge_8a0092ff8e0ccafa018e0e9af50801ef-Groenland-Ilulissat-Buckelwale.jpg&feedId=115640&k=fb3faa83d7d55ec0370bb5a0b9c50c589fe8c6fe,EUR,,,https://www.berge-meer.de/angebote/island-groenland-schottland-kreuzfahrt-mit-ms-hamburg-von-kangerlussuaq-bis-hamburg-2,,,EUR4399.00,115640
https://www.awin1.com/pclick.php?p=44865574221&a=2914133&m=10990,"Westkanada & Alaska - Kreuzfahrt mit Nieuw Amsterdam von Vancouver bis Whittier inkl. Westkanada-Rundreise & Denali Nationalpark",44865574221,8a0092ff9d94417f019d9562f0207241,https://d13d0f5of5vzfo.cloudfront.net/images/products/8a0092ff9d94417f019d9562f0207241/large_8a0092ff9d84cede019d85a68cae4324-USA-Alaska-Denali-Nationalpark.jpg,"Gewaltige Gletscher, endlose Wälder und spektakuläre Panoramen - diese außergewöhnliche Reise vereint Westkanadas Naturwunder mit einer intensiven Alaska-Kreuzfahrt und Abenteuer-Nachprogramm im Denali Nationalpark. Von den Rocky Mountains bis zur Inside Passage erleben Sie Nordamerika so umfassend wie auf kaum einer andere Reise, inklusive McKinley Panoramazug und Lodge inmitten der Wildnis.",,5299.00,"Berge & Meer",10990,,,https://images2.productserve.com/?w=200&h=200&bg=white&trim=5&t=letterbox&url=ssl%3Ad13d0f5of5vzfo.cloudfront.net%2Fimages%2Fproducts%2F8a0092ff9d94417f019d9562f0207241%2Flarge_8a0092ff9d84cede019d85a68cae4324-USA-Alaska-Denali-Nationalpark.jpg&feedId=115640&k=4f01f1972ed28774867d9d4819220c8bfd0bb5fc,EUR,,,https://www.berge-meer.de/angebote/westkanada-alaska-kreuzfahrt-mit-nieuw-amsterdam-von-vancouver-bis-whittier-inkl-westkanada-rundreise-und-denali-nationalpark,,,EUR5299.00,115640
https://www.awin1.com/pclick.php?p=44865574222&a=2914133&m=10990,"Ostsee - Baltikum/Skandinavien - Kreuzfahrt mit der MSC Magnifica ab/an Warnemünde",44865574222,8a0092ff9d94417f019d95bcf0282452,https://d13d0f5of5vzfo.cloudfront.net/images/products/8a0092ff9d94417f019d95bcf0282452/large_8a0092ff8ea1ec79018ea37642a912d2-Schweden-Stockholm.jpg,"Erleben Sie mit der MSC Magnifica die schönsten Städte an der Ostsee: Freuen Sie sich auf imposante europäische Hauptstädte wie Riga, Tallinn, Stockholm, Kopenhagen oder Helsinki, erleben Sie das nordische Flair und die Kultur der baltischen Küste. Die Routen führen Sie zu historischen Altstädten, Dünen, Leuchttürmen und maritimen Landschaften - auf einer Variante ergänzt durch Visby auf Gotland.",,1699.00,"Berge & Meer",10990,,,https://images2.productserve.com/?w=200&h=200&bg=white&trim=5&t=letterbox&url=ssl%3Ad13d0f5of5vzfo.cloudfront.net%2Fimages%2Fproducts%2F8a0092ff9d94417f019d95bcf0282452%2Flarge_8a0092ff8ea1ec79018ea37642a912d2-Schweden-Stockholm.jpg&feedId=115640&k=7becfae4fb17eb591a850fe7e026846a62bc6636,EUR,,,https://www.berge-meer.de/angebote/ostsee-baltikum-skandinavien-kreuzfahrt-mit-der-msc-magnifica-ab-an-warnemuende,,,EUR1699.00,115640
https://www.awin1.com/pclick.php?p=44865574223&a=2914133&m=10990,"Ostsee - Norwegen - Oslo - Mini-Kreuzfahrt mit der Color Fantasy/Magic ab/an Kiel",44865574223,8a0092ff9da8db65019daafd14232e08,https://d13d0f5of5vzfo.cloudfront.net/images/products/8a0092ff9da8db65019daafd14232e08/large_8a0092ff993be44301993d03e7f75cf9-Norwegen--Oslo.jpg,"Erleben Sie an Bord der Color Fantasy oder Magic malerische Ausblicke auf Ostsee und Oslofjord. In der norwegischen Hauptstadt erwartet Sie eine spannende Mischung aus moderner Architektur, historischen Sehenswürdigkeiten, kulturellen Highlights und beeindruckender Natur. Sie genießen eine Nacht in Oslo und haben genug Zeit, die Stadt zu erkunden, die Sie mit ihrer Vielfältigkeit verzaubern wird.",,389.00,"Berge & Meer",10990,,,https://images2.productserve.com/?w=200&h=200&bg=white&trim=5&t=letterbox&url=ssl%3Ad13d0f5of5vzfo.cloudfront.net%2Fimages%2Fproducts%2F8a0092ff9da8db65019daafd14232e08%2Flarge_8a0092ff993be44301993d03e7f75cf9-Norwegen--Oslo.jpg&feedId=115640&k=5bf2586de103d2f1ec04b5cf29cd180b26ed0e0c,EUR,,,https://www.berge-meer.de/angebote/ostsee-norwegen-oslo-mini-kreuzfahrt-mit-der-color-fantasy-magic-ab-an-kiel-3,,,EUR389.00,115640
https://www.awin1.com/pclick.php?p=44865574224&a=2914133&m=10990,"Donau - Silvesterkreuzfahrt mit A-ROSA RIVA ab/an Passau",44865574224,8a0092ff9dae013f019dafbec14444d3,https://d13d0f5of5vzfo.cloudfront.net/images/products/8a0092ff9dae013f019dafbec14444d3/large_8a0092ff9dae013f019dafbce2b3318b-Budapest-Ungarn-Feuerwerk-Silvester.jpg,"Den Jahreswechsel auf der Donau zu verbringen, verbindet festliche Eleganz mit unvergesslichen Erlebnissen. An Bord von A-ROSA RIVA genießen Sie Premium alles inklusive und reisen entspannt durch winterliche Landschaften bis nach Budapest. Dort erwartet Sie ein spektakuläres Silvester mit funkelndem Feuerwerk über der Donau, bevor das neue Jahr stilvoll und entspannt an Bord beginnt.",,1399.00,"Berge & Meer",10990,,,https://images2.productserve.com/?w=200&h=200&bg=white&trim=5&t=letterbox&url=ssl%3Ad13d0f5of5vzfo.cloudfront.net%2Fimages%2Fproducts%2F8a0092ff9dae013f019dafbec14444d3%2Flarge_8a0092ff9dae013f019dafbce2b3318b-Budapest-Ungarn-Feuerwerk-Silvester.jpg&feedId=115640&k=e64a1c158f46dd9c0b8dbfd00feabe7d40f182f6,EUR,,,https://www.berge-meer.de/angebote/donau-silvesterkreuzfahrt-mit-a-rosa-riva-ab-an-passau,,,EUR1399.00,115640
https://www.awin1.com/pclick.php?p=44865574225&a=2914133&m=10990,"Kanaren & Madeira - Kreuzfahrt mit AIDAcosma ab/an Santa Cruz de Tenerife inkl. 4 Nächte Hotel",44865574225,8a0092ff9dbd74ed019dc01b95061377,https://d13d0f5of5vzfo.cloudfront.net/images/products/8a0092ff9dbd74ed019dc01b95061377/large_8a0092ff889e1ef701889f46a7a94b92-AIDAcosma.jpg,"Lust auf Sonne, Meer und unvergessliche Erlebnisse? Verbringen Sie traumhafte Tage auf dem Atlantik an Bord von AIDAcosma! Entdecken Sie die faszinierende Vielfalt der Kanarischen Inseln, schlendern Sie durch Madeiras Blütenpracht und genießen Sie nach der Kreuzfahrt pure Erholung bei einem entspannten Hotelaufenthalt auf Teneriffa. Die perfekte Kombination für Ihre wohlverdiente Winterauszeit!",,1499.00,"Berge & Meer",10990,,,https://images2.productserve.com/?w=200&h=200&bg=white&trim=5&t=letterbox&url=ssl%3Ad13d0f5of5vzfo.cloudfront.net%2Fimages%2Fproducts%2F8a0092ff9dbd74ed019dc01b95061377%2Flarge_8a0092ff889e1ef701889f46a7a94b92-AIDAcosma.jpg&feedId=115640&k=69e941a4ee63ac92299297ff9bc6afd46f0f6790,EUR,,,https://www.berge-meer.de/angebote/kanaren-madeira-kreuzfahrt-mit-aidacosma-ab-an-santa-cruz-de-tenerife-inkl-4-naechte-hotel,,,EUR1499.00,115640
https://www.awin1.com/pclick.php?p=44865574226&a=2914133&m=10990,"Östliches Mittelmeer - Kreuzfahrt mit der Celestyal Journey ab/an Piräus inkl. Griechenland-Rundreise",44865574226,8a0092ff9dcce7f2019dce5c2d97276d,https://d13d0f5of5vzfo.cloudfront.net/images/products/8a0092ff9dcce7f2019dce5c2d97276d/large_8a0092ff68bbc50c0168be5f80370174-Griechenland-Santorin.jpg,"Auf den Spuren der Antike Griechenland intensiv erleben: Von der Akropolis in Athen über historische Stätten in Epidaurus, Mykene, Olympia und Delphi bis zu den Felsen von Meteora. Dann bereisen Sie mit der Celestyal Journey die Adria oder die Ägäis. Je nach Route besuchen Sie Kroatien, Montenegro, Italien oder die Türkei. Genießen Sie das mediterrane Flair aus Inseln, Sonne, Meer und Geschichte.",,2899.00,"Berge & Meer",10990,,,https://images2.productserve.com/?w=200&h=200&bg=white&trim=5&t=letterbox&url=ssl%3Ad13d0f5of5vzfo.cloudfront.net%2Fimages%2Fproducts%2F8a0092ff9dcce7f2019dce5c2d97276d%2Flarge_8a0092ff68bbc50c0168be5f80370174-Griechenland-Santorin.jpg&feedId=115640&k=cd33bd9316d70b6d3d9728b3a2711b5fbed81f87,EUR,,,https://www.berge-meer.de/angebote/oestliches-mittelmeer-kreuzfahrt-mit-der-celestyal-journey-ab-an-piraeus-inkl-griechenland-rundreise,,,EUR2899.00,115640
https://www.awin1.com/pclick.php?p=44865574227&a=2914133&m=10990,"Östliches Mittelmeer - Kreuzfahrt mit der MSC Orchestra ab/an Istanbul",44865574227,8a0092ff9dd20e44019dd38a8c2046c1,https://d13d0f5of5vzfo.cloudfront.net/images/products/8a0092ff9dd20e44019dd38a8c2046c1/large_8a0092fd50421d2e015042d670b937b0-MSC-Kreuzfahrten-MSC-Orchestra.jpg,"Ihre Reise beginnt mit einer Nacht in der Metropole Istanbul, wo Orient und Okzident am Bosporus miteinander verschmelzen. Auf der Kreuzfahrt genießen Sie historische Höhepunkte wie Korfu, Bari, Piräus/Athen und Izmir. Zum Abschluss erwartet Sie eine weitere Nacht in Istanbul.",,1299.00,"Berge & Meer",10990,,,https://images2.productserve.com/?w=200&h=200&bg=white&trim=5&t=letterbox&url=ssl%3Ad13d0f5of5vzfo.cloudfront.net%2Fimages%2Fproducts%2F8a0092ff9dd20e44019dd38a8c2046c1%2Flarge_8a0092fd50421d2e015042d670b937b0-MSC-Kreuzfahrten-MSC-Orchestra.jpg&feedId=115640&k=c68eb7843cf5fea4c782c7c47488beae013eba63,EUR,,,https://www.berge-meer.de/angebote/oestliches-mittelmeer-kreuzfahrt-mit-der-msc-orchestra-ab-an-istanbul-bum-inkl-kappadokien-rundreise,,,EUR1299.00,115640
https://www.awin1.com/pclick.php?p=44865574228&a=2914133&m=10990,"Dänemark - Kopenhagen & Grönland - Arktis-Expeditionskreuzfahrt mit Ocean Albatros ab/an Kangerlussuaq inkl. Zodiac-Fahrten",44865574228,8a0092ff9dd20e44019dd3fa2b8173ee,https://d13d0f5of5vzfo.cloudfront.net/images/products/8a0092ff9dd20e44019dd3fa2b8173ee/large_8a0092ff8ce74060018ce99205512ea8-Albatros-Expeditions-Ocean-Albatros-Antarktis.jpg,"Eisberge, Stille und pure Wildnis - diese Expeditionsreise führt Sie dorthin, wo die Natur den Ton angibt. An Bord der exklusiven Ocean Albatros erleben Sie Grönlands spektakuläre Küsten intensiv und persönlich. Kleine Gruppen, echte Expeditionen und ein nachhaltiges Schiff machen dieses Abenteuer einzigartig. Näher, ursprünglicher und beeindruckender lässt sich die Arktis kaum entdecken.",,5799.00,"Berge & Meer",10990,,,https://images2.productserve.com/?w=200&h=200&bg=white&trim=5&t=letterbox&url=ssl%3Ad13d0f5of5vzfo.cloudfront.net%2Fimages%2Fproducts%2F8a0092ff9dd20e44019dd3fa2b8173ee%2Flarge_8a0092ff8ce74060018ce99205512ea8-Albatros-Expeditions-Ocean-Albatros-Antarktis.jpg&feedId=115640&k=943658ce42083c73393cedb80be551c4867b58ad,EUR,,,https://www.berge-meer.de/angebote/daenemark-kopenhagen-groenland-arktis-expeditionskreuzfahrt-mit-ocean-albatros-ab-an-kangerlussuaq-inkl-zodiac-fahrten,,,EUR5799.00,115640
