aw_deep_link,product_name,aw_product_id,merchant_product_id,merchant_image_url,description,merchant_category,search_price,merchant_name,merchant_id,category_name,category_id,aw_image_url,currency,store_price,delivery_cost,merchant_deep_link,language,last_updated,display_price,data_feed_id
https://www.awin1.com/pclick.php?p=44865574248&a=2914133&m=10990,"Niederlande - IJsselmeer - Mit Rad & Segelschiff Leafde fan Fryslân ab/an Enkhuizen",44865574248,8a0092ff98301996019830fdf0fa7ce2,https://d13d0f5of5vzfo.cloudfront.net/images/products/8a0092ff98301996019830fdf0fa7ce2/large_8a0092ff8dc4b1f5018dc72d2cd842d4-Segeln-Segelboot-Paar-Best-Ager.jpg,"Entdecken Sie die Vielfalt des IJsselmeers - vom Rad aus und unter Segeln. Zwischen Nordseeinseln, charmanten Hafenstädten und weiten Polderlandschaften erleben Sie Holland aktiv, authentisch und erfrischend anders. Freuen Sie sich auf bewegte Tage an Bord eines traditionellen Segelschiffs - begleitet von Wind, Wasser und Weitblick.",,1419.00,"Berge & Meer",10990,,,https://images2.productserve.com/?w=200&h=200&bg=white&trim=5&t=letterbox&url=ssl%3Ad13d0f5of5vzfo.cloudfront.net%2Fimages%2Fproducts%2F8a0092ff98301996019830fdf0fa7ce2%2Flarge_8a0092ff8dc4b1f5018dc72d2cd842d4-Segeln-Segelboot-Paar-Best-Ager.jpg&feedId=115640&k=08e1727d8c16e343aebced4b60b3895b5804170e,EUR,,,https://www.berge-meer.de/angebote/niederlande-ijsselmeer-freiheit-zwischen-duenen-deichen-und-hafenromantik,,,EUR1419.00,115640
https://www.awin1.com/pclick.php?p=44865574249&a=2914133&m=10990,"Skandinavien - Lappland - Kreuzfahrt mit MS Hamburg ab/an Hamburg",44865574249,8a0092ff983f8ca90198401d7b4d049b,https://d13d0f5of5vzfo.cloudfront.net/images/products/8a0092ff983f8ca90198401d7b4d049b/large_8a0092ff9ce03a4f019ce2d741f06d32-Schweden-Stockholm-Winter-Schnee.jpg,"Skandinavischer Winter mit MS Hamburg: Durch den Nord-Ostsee-Kanal reisen Sie in den winterlichen Norden. Finnlands Küstenstädte Turku, Pori und Vaasa, die Åland Inseln sowie schwedische Ziele wie Umeå, Sundsvall und Stockholm zeigen den Norden in einer besonderen Winterstimmung. Das mittelalterliche Visby auf Gotland rundet die Route ab. Mit etwas Glück sind unterwegs sogar Nordlichter zu sehen.",,2599.00,"Berge & Meer",10990,,,https://images2.productserve.com/?w=200&h=200&bg=white&trim=5&t=letterbox&url=ssl%3Ad13d0f5of5vzfo.cloudfront.net%2Fimages%2Fproducts%2F8a0092ff983f8ca90198401d7b4d049b%2Flarge_8a0092ff9ce03a4f019ce2d741f06d32-Schweden-Stockholm-Winter-Schnee.jpg&feedId=115640&k=0801404ee6ba063e70806931316dc42d149915ab,EUR,,,https://www.berge-meer.de/angebote/skandinavien-kreuzfahrt-mit-ms-hamburg-ab-an-kiel-oder-ab-an-hamburg,,,EUR2599.00,115640
https://www.awin1.com/pclick.php?p=44865574250&a=2914133&m=10990,"Südamerika, Panamakanal & USA - Kreuzfahrt mit Oosterdam ab Buenos Aires an Fort Lauderdale inkl. Nachprogramm in Miami",44865574250,8a0092ff9993705a0199960170e846df,https://d13d0f5of5vzfo.cloudfront.net/images/products/8a0092ff9993705a0199960170e846df/large_8a0092ff997ed7230199809fc3103a9e-Chile-Magellanstrasse.jpg,"Starten Sie Ihr Abenteuer in Buenos Aires und erleben Sie eine Kreuzfahrt voller Höhepunkte: Patagoniens Fjorde, die spektakuläre Umrundung des Kap Hoorn und die Durchquerung des Panamakanals. Auf der eleganten Oosterdam genießen Sie Komfort und Genuss, während Sie den Äquator überqueren und Ihre Reise schließlich im sonnigen Miami voll unvergesslicher Eindrücke beenden.",,5999.00,"Berge & Meer",10990,,,https://images2.productserve.com/?w=200&h=200&bg=white&trim=5&t=letterbox&url=ssl%3Ad13d0f5of5vzfo.cloudfront.net%2Fimages%2Fproducts%2F8a0092ff9993705a0199960170e846df%2Flarge_8a0092ff997ed7230199809fc3103a9e-Chile-Magellanstrasse.jpg&feedId=115640&k=6b38b87eead183bd26cb9cd2c556e5d4a3577862,EUR,,,https://www.berge-meer.de/angebote/suedamerika-panamakanal-usa-kreuzfahrt-mit-oosterdam-ab-buenos-aires-an-fort-lauderdale-inkl-nachprogramm-in-miami,,,EUR5999.00,115640
https://www.awin1.com/pclick.php?p=44865574251&a=2914133&m=10990,"USA, Südamerika & Panamakanal - Kreuzfahrt mit Oosterdam ab Fort Lauderdale an Buenos Aires inkl. Vorprogramm in Miami",44865574251,8a0092ff9993705a0199961599167743,https://d13d0f5of5vzfo.cloudfront.net/images/products/8a0092ff9993705a0199961599167743/large_8a0092fd50421d2e015042fc47b05968-Holland-American-Line-MS-Oosterdam.jpg,"Ein Abenteuer der Superlative erwartet Sie: Von Floridas tropischer Sonne starten Sie mit der eleganten Oosterdam durch den legendären Panamakanal, überqueren den Äquator und entdecken kontrastreiche Landschaften bis in die eisigen Fjorde Patagoniens. Komfort, Genuss und unvergessliche Eindrücke begleiten Sie - gekrönt von der spektakulären Umrundung des Kap Hoorn.",,5999.00,"Berge & Meer",10990,,,https://images2.productserve.com/?w=200&h=200&bg=white&trim=5&t=letterbox&url=ssl%3Ad13d0f5of5vzfo.cloudfront.net%2Fimages%2Fproducts%2F8a0092ff9993705a0199961599167743%2Flarge_8a0092fd50421d2e015042fc47b05968-Holland-American-Line-MS-Oosterdam.jpg&feedId=115640&k=dc8cb329215c5108c0d6a01b564678a2a9de2bbd,EUR,,,https://www.berge-meer.de/angebote/usa-suedamerika-panamakanal-kreuzfahrt-mit-oosterdam-ab-fort-lauderdale-an-buenos-aires-inkl-vorprogramm-in-miami,,,EUR5999.00,115640
https://www.awin1.com/pclick.php?p=44865574252&a=2914133&m=10990,"Ostsee & Nordsee - Kreuzfahrt mit MS Hamburg von Hamburg bis Kiel",44865574252,8a0092ff9c0d15b5019c0f052bc1216a,https://d13d0f5of5vzfo.cloudfront.net/images/products/8a0092ff9c0d15b5019c0f052bc1216a/large_8a0092ff8ec5f8ec018ec8b5f6e24e4d-Sylt-Leuchtturm.jpg,"Freuen Sie sich auf eine kompakte Kreuzfahrt mit MS Hamburg voller Inselmomente und nordfriesischem Flair: Von Hamburg aus geht es nach Den Helder auf der Insel Texel, dem niederländischen Wattenmeerhafen Harlingen und zu den Inseln Sylt und Helgoland. Ein besonderes Highlight ist die Passage durch den Nord-Ostsee-Kanal - eine der spannendsten Wasserstraßen Europas - bevor Sie in Kiel ausschiffen.",,1199.00,"Berge & Meer",10990,,,https://images2.productserve.com/?w=200&h=200&bg=white&trim=5&t=letterbox&url=ssl%3Ad13d0f5of5vzfo.cloudfront.net%2Fimages%2Fproducts%2F8a0092ff9c0d15b5019c0f052bc1216a%2Flarge_8a0092ff8ec5f8ec018ec8b5f6e24e4d-Sylt-Leuchtturm.jpg&feedId=115640&k=eb0e16a54c16de08919e40f7ffca1f8362fd2c34,EUR,,,https://www.berge-meer.de/angebote/nordsee-ostsee-kreuzfahrt-mit-der-ms-hamburg-ab-hamburg-an-kiel,,,EUR1199.00,115640
https://www.awin1.com/pclick.php?p=44865574253&a=2914133&m=10990,"Südamerika - Kreuzfahrt mit Oosterdam von Santiago de Chile bis Buenos Aires",44865574253,8a0092ff9c2bfbe0019c2c86fb9b1c6e,https://d13d0f5of5vzfo.cloudfront.net/images/products/8a0092ff9c2bfbe0019c2c86fb9b1c6e/large_8a0092fd50421d2e015042fc39405750-Holland-American-Line-MS-Oosterdam.jpg,"Das ist Südamerika pur: Zwischen Santiago de Chile und Buenos Aires kreuzen Sie mit Oosterdam rund um Kap Hoorn - durch majestätische Fjorde, bizarre Eislandschaften und faszinierende Tierparadiese. Entdecken Sie Feuerland, die Falklandinseln und Montevideo.",,3699.00,"Berge & Meer",10990,,,https://images2.productserve.com/?w=200&h=200&bg=white&trim=5&t=letterbox&url=ssl%3Ad13d0f5of5vzfo.cloudfront.net%2Fimages%2Fproducts%2F8a0092ff9c2bfbe0019c2c86fb9b1c6e%2Flarge_8a0092fd50421d2e015042fc39405750-Holland-American-Line-MS-Oosterdam.jpg&feedId=115640&k=19ec0bf0386ab77a2410e0a07cef18b4527260cd,EUR,,,https://www.berge-meer.de/angebote/suedamerika-kreuzfahrt-mit-oosterdam-ab-santiago-de-chile-an-buenos-aires-2,,,EUR3699.00,115640
https://www.awin1.com/pclick.php?p=44865574254&a=2914133&m=10990,"Transafrika - Kreuzfahrt mit der MSC Armonia von Durban bis Venedig inkl. Südafrika-Rundreise",44865574254,8a0092ff9c2bfbe0019c2d62a6d84659,https://d13d0f5of5vzfo.cloudfront.net/images/products/8a0092ff9c2bfbe0019c2d62a6d84659/large_8a0092ff6e844399016e847bb40520d4-Krueger-Nationalpark-Elefanten.jpg,"Erleben Sie die Tierwelt Afrikas, Traumziele im Indischen Ozean und mediterranes Flair am Mittelmeer: Zunächst genießen Sie afrikanisches Großstadtfeeling in Durban und eine Rundreise durch Südafrika und den Krüger Nationalpark, bevor Sie mit der MSC Armonia auf dem Weg nach Venedig exotische Ziele wie Südafrika, Mauritius, Madagaskar, die Seychellen, Jordanien, Ägypten und Griechenland entdecken.",,4139.00,"Berge & Meer",10990,,,https://images2.productserve.com/?w=200&h=200&bg=white&trim=5&t=letterbox&url=ssl%3Ad13d0f5of5vzfo.cloudfront.net%2Fimages%2Fproducts%2F8a0092ff9c2bfbe0019c2d62a6d84659%2Flarge_8a0092ff6e844399016e847bb40520d4-Krueger-Nationalpark-Elefanten.jpg&feedId=115640&k=b35671fcd4926d51c169b99672e640fa6bcf664f,EUR,,,https://www.berge-meer.de/angebote/transafrika-kreuzfahrt-von-durban-bis-venedig-inkl-suedafrika-rundreise-2,,,EUR4139.00,115640
https://www.awin1.com/pclick.php?p=44865574255&a=2914133&m=10990,"Transpazifik - Kreuzfahrt mit der Quantum of the Seas von Brisbane bis Seattle inkl. Vor- & Nachprogramm",44865574255,8a0092ff9c88ae51019c8aff423f7a34,https://d13d0f5of5vzfo.cloudfront.net/images/products/8a0092ff9c88ae51019c8aff423f7a34/large_8a0092ff6bff7e8c016c0a1ed5114be1-Tahiti-Papeete-Bora-Bora.jpg,"Nach einem Aufenthalt in Sydney und Brisbane, den Metropolen des roten Kontinents, geht es mit der Quantum of the Seas zu den schönsten Orten der Südsee und des Pazifiks. Die Route führt über Tahiti, Moorea und Raiatea in Französisch-Polynesien zu der traumhaften hawaiianischen Insel O'ahu, bevor das Schiff in Seattle an der Westküste der USA anlegt. Nach einer Übernachtung endet die Reise dort.",,4199.00,"Berge & Meer",10990,,,https://images2.productserve.com/?w=200&h=200&bg=white&trim=5&t=letterbox&url=ssl%3Ad13d0f5of5vzfo.cloudfront.net%2Fimages%2Fproducts%2F8a0092ff9c88ae51019c8aff423f7a34%2Flarge_8a0092ff6bff7e8c016c0a1ed5114be1-Tahiti-Papeete-Bora-Bora.jpg&feedId=115640&k=7943feee5febd51a8d3508692d5c01759e77e1b6,EUR,,,https://www.berge-meer.de/angebote/transpazifik-kreuzfahrt-mit-der-quantum-of-the-seas-von-brisbane-bis-seattle-inkl-vor-nachprogramm,,,EUR4199.00,115640
https://www.awin1.com/pclick.php?p=44865574256&a=2914133&m=10990,"Donau - Flusskreuzfahrt mit MS Lady Cristina ab/an Passau",44865574256,8a0092ff9c8dd4a9019c8f5be4c42685,https://d13d0f5of5vzfo.cloudfront.net/images/products/8a0092ff9c8dd4a9019c8f5be4c42685/large_8a0092ff9c7414df019c762ceade6f5f-Budapest-Ungarn-Abendaufnahme-Stadtansicht.jpg,"Erleben Sie die Donau im November von ihrer stimmungsvollsten Seite an Bord von MS LADY CRISTINA. Erkunden Sie europäische Hauptstädte und beeindruckende Flusslandschaften. Von Passau führt Sie Ihre Reise durch die Wachau nach Wien, Budapest und Bratislava sowie nach Melk. In der herbstlich-voradventlichen Atmosphäre des Novembers erleben Sie Kultur, Geschichte und besondere Momente auf der Donau.",,769.00,"Berge & Meer",10990,,,https://images2.productserve.com/?w=200&h=200&bg=white&trim=5&t=letterbox&url=ssl%3Ad13d0f5of5vzfo.cloudfront.net%2Fimages%2Fproducts%2F8a0092ff9c8dd4a9019c8f5be4c42685%2Flarge_8a0092ff9c7414df019c762ceade6f5f-Budapest-Ungarn-Abendaufnahme-Stadtansicht.jpg&feedId=115640&k=8c80789935efcd4e1d73f8dcf7131a482b2d9c37,EUR,,,https://www.berge-meer.de/angebote/donau-flusskreuzfahrt-mit-ms-lady-cristina-ab-an-passau,,,EUR769.00,115640
https://www.awin1.com/pclick.php?p=44865574257&a=2914133&m=10990,"Spanien, Portugal & Marokko - Kreuzfahrt mit MS Hamburg von Málaga bis Lissabon",44865574257,8a0092ff9ce560b1019ce6f88858747f,https://d13d0f5of5vzfo.cloudfront.net/images/products/8a0092ff9ce560b1019ce6f88858747f/large_8a0092ff704393e90170583446e82578-Europa-Portugal-Madeira-Funchal-Levada-do-Furado.jpg,"Mit MS Hamburg dem Winter entfliehen und Kurs Richtung Sonne nehmen: Málaga und der legendäre Felsen von Gibraltar, Weihnachten zwischen orientalischen Gassen in Tanger und dem Flair Casablancas verbringen und dann die Kanaren mit Lanzarote, Gran Canaria, Teneriffa und El Hierro kennenlernen. Silvester und Neujahr feiern Sie in Funchal auf Madeira, bevor Portimão und Lissabon den Abschluss bilden.",,3199.00,"Berge & Meer",10990,,,https://images2.productserve.com/?w=200&h=200&bg=white&trim=5&t=letterbox&url=ssl%3Ad13d0f5of5vzfo.cloudfront.net%2Fimages%2Fproducts%2F8a0092ff9ce560b1019ce6f88858747f%2Flarge_8a0092ff704393e90170583446e82578-Europa-Portugal-Madeira-Funchal-Levada-do-Furado.jpg&feedId=115640&k=de82bafed0a4e49a18afedfe18e32623258096d4,EUR,,,https://www.berge-meer.de/angebote/spanien-portugal-marokko-kreuzfahrt-mit-ms-hamburg-von-malaga-bis-lissabon,,,EUR3199.00,115640
https://www.awin1.com/pclick.php?p=44865574258&a=2914133&m=10990,"Kanaren & Madeira - Kreuzfahrt mit AIDAcosma ab/an Teneriffa inkl. 2 Wochen Hotelaufenthalt",44865574258,8a0092ff9d2d79b7019d2fc7d8ef4f2c,https://d13d0f5of5vzfo.cloudfront.net/images/products/8a0092ff9d2d79b7019d2fc7d8ef4f2c/large_8a0092fd50421d2e01511b690f463385-Fuellbild.jpg,"Zwischen schwarzem Lavastrand, grünen Tälern und dem weiten Atlantik entfaltet sich Ihre Traumkreuzfahrt mit AIDAcosma. Entdecken Sie die Vielfalt der Kanaren und Madeira bei angenehmen Temperaturen und genießen Sie das entspannte Bordleben. Danach erwarten Sie 14 erholsame Tage im 4-Sterne-Hotel auf Teneriffa - mit traumhaftem Blick auf den Atlantik.",,2149.00,"Berge & Meer",10990,,,https://images2.productserve.com/?w=200&h=200&bg=white&trim=5&t=letterbox&url=ssl%3Ad13d0f5of5vzfo.cloudfront.net%2Fimages%2Fproducts%2F8a0092ff9d2d79b7019d2fc7d8ef4f2c%2Flarge_8a0092fd50421d2e01511b690f463385-Fuellbild.jpg&feedId=115640&k=6778b8cc2226f82876f1251cd6ca49bc150b9f0f,EUR,,,https://www.berge-meer.de/angebote/kanaren-madeira-kreuzfahrt-mit-aidacosma-ab-an-teneriffa-inkl-2-wochen-hotelaufenthalt-3,,,EUR2149.00,115640
https://www.awin1.com/pclick.php?p=44865574259&a=2914133&m=10990,"Norwegen - Spitzbergen - Kreuzfahrt mit der MSC Preziosa ab/an Hamburg",44865574259,8a0092ff9d4c2863019d4e25ab700c9a,https://d13d0f5of5vzfo.cloudfront.net/images/products/8a0092ff9d4c2863019d4e25ab700c9a/large_8a0092ff8f6077c6018f617b7d62560a-Norwegen-Berge.jpg,"Mit der MSC Preziosa von Hamburg bis in den hohen Norden und über den Polarkreis: Über Bergen und die Rosenstadt Molde führt die Reise bis nach Tromsø, zum Nordkap bei Honningsvåg und nach Longyearbyen auf Spitzbergen. Je nach Route entdecken Sie zudem das charmante Stavanger oder das maritime Haugesund. Auf zwei Routen erwarten Sie spektakuläre Fjorde, arktische Natur und faszinierende Städte.",,1999.00,"Berge & Meer",10990,,,https://images2.productserve.com/?w=200&h=200&bg=white&trim=5&t=letterbox&url=ssl%3Ad13d0f5of5vzfo.cloudfront.net%2Fimages%2Fproducts%2F8a0092ff9d4c2863019d4e25ab700c9a%2Flarge_8a0092ff8f6077c6018f617b7d62560a-Norwegen-Berge.jpg&feedId=115640&k=2bb0aee921ffe7dec606796d83fe697db8ddb5eb,EUR,,,https://www.berge-meer.de/angebote/norwegen-spitzbergen-kreuzfahrt-mit-der-msc-preziosa-ab-an-hamburg,,,EUR1999.00,115640
https://www.awin1.com/pclick.php?p=44865574260&a=2914133&m=10990,"Grönland - Kreuzfahrt mit MS Hamburg ab/an Kangerlussuaq",44865574260,8a0092ff9d65e8c2019d6802e6310977,https://d13d0f5of5vzfo.cloudfront.net/images/products/8a0092ff9d65e8c2019d6802e6310977/large_8a0092ff9057a8f101905a0c9b7e7c80-Plantours-Kreuzfahrten-MS-Hamburg.jpg,"Auf dieser besonderen Grönland-Kreuzfahrt mit MS Hamburg erleben Sie auf zwei Routen majestätische Fjorde und gewaltige Eisberge: Entdecken Sie die Diskobucht mit Ilulissat, den mächtigen Eqip Ser­mia-Gletscher oder reisen Sie noch weiter in den Norden bis nach Thule und Kap York. Abgelegene Orte wie Uummannaq und Savissivik sowie Naturwunder machen die Reise zu einem intensiven Arktis-Abenteuer.",,3599.00,"Berge & Meer",10990,,,https://images2.productserve.com/?w=200&h=200&bg=white&trim=5&t=letterbox&url=ssl%3Ad13d0f5of5vzfo.cloudfront.net%2Fimages%2Fproducts%2F8a0092ff9d65e8c2019d6802e6310977%2Flarge_8a0092ff9057a8f101905a0c9b7e7c80-Plantours-Kreuzfahrten-MS-Hamburg.jpg&feedId=115640&k=6d5426a3812a255adf2c3eb905dc673ff03487d6,EUR,,,https://www.berge-meer.de/angebote/groenland-kreuzfahrt-mit-ms-hamburg-ab-an-kangerlussuaq-2,,,EUR3599.00,115640
https://www.awin1.com/pclick.php?p=44865574261&a=2914133&m=10990,"Donau - Adventskreuzfahrt mit A-ROSA MIA ab/an Passau",44865574261,8a0092ff9dae013f019dafbc592c1216,https://d13d0f5of5vzfo.cloudfront.net/images/products/8a0092ff9dae013f019dafbc592c1216/large_8a0092ff9abe5847019abfe20f527d78-Weihnachtsmarkt-Frau-Gluehwein.jpg,"Wenn sich der Duft von Zimt und Punsch über festlich geschmückte Altstädte legt, beginnt Ihre Winter-Auszeit auf der Donau. An Bord der A-ROSA MIA genießen Sie Premium alles inklusive und reisen entspannt zu den schönsten Weihnachtsmärkten zwischen Wien, der Wachau und Linz. Lichterglanz, barocke Kulissen und stille Flusslandschaften sorgen für einen genussvollen Start in die Adventszeit.",,499.00,"Berge & Meer",10990,,,https://images2.productserve.com/?w=200&h=200&bg=white&trim=5&t=letterbox&url=ssl%3Ad13d0f5of5vzfo.cloudfront.net%2Fimages%2Fproducts%2F8a0092ff9dae013f019dafbc592c1216%2Flarge_8a0092ff9abe5847019abfe20f527d78-Weihnachtsmarkt-Frau-Gluehwein.jpg&feedId=115640&k=900b4ca0b362821f138190a84eae4a7d884ccedc,EUR,,,https://www.berge-meer.de/angebote/donau-adventskreuzfahrt-mit-a-rosa-mia-ab-an-passau,,,EUR499.00,115640
https://www.awin1.com/pclick.php?p=44865574262&a=2914133&m=10990,"Donau - Weihnachtskreuzfahrt mit A-ROSA RIVA ab/an Passau",44865574262,8a0092ff9dae013f019dafbe2240026c,https://d13d0f5of5vzfo.cloudfront.net/images/products/8a0092ff9dae013f019dafbe2240026c/large_8a0092fd50421d2e015042da99215197-A-ROSA-Flusskreuzfahrten-A-ROSA-Flussschiff.jpg,"Freuen Sie sich auf festliche Tage voller Ruhe, Genuss und besonderer Momente. An Bord der A-ROSA RIVA erleben Sie Premium alles inklusive und feiern Weihnachten in stilvoller, entspannter Atmosphäre auf dem Fluss. Während draußen winterliche Landschaften vorbeiziehen, erwarten Sie glanzvolle Städte wie Wien und Bratislava. Eine besinnliche Auszeit voller Lichterglanz, die lange nachklingt.",,729.00,"Berge & Meer",10990,,,https://images2.productserve.com/?w=200&h=200&bg=white&trim=5&t=letterbox&url=ssl%3Ad13d0f5of5vzfo.cloudfront.net%2Fimages%2Fproducts%2F8a0092ff9dae013f019dafbe2240026c%2Flarge_8a0092fd50421d2e015042da99215197-A-ROSA-Flusskreuzfahrten-A-ROSA-Flussschiff.jpg&feedId=115640&k=cdfa7488dcbbf1549d3ccb882509e64965640bd6,EUR,,,https://www.berge-meer.de/angebote/donau-weihnachtskreuzfahrt-mit-a-rosa-riva-ab-an-passau,,,EUR729.00,115640
https://www.awin1.com/pclick.php?p=44865574263&a=2914133&m=10990,"Rhein & Main - Weihnachts-Flusskreuzfahrt mit A-ROSA SILVA ab/an Köln",44865574263,8a0092ff9db84e8c019db9c3d0d84591,https://d13d0f5of5vzfo.cloudfront.net/images/products/8a0092ff9db84e8c019db9c3d0d84591/large_8a0092ff9db84e8c019db946e25c65dd-Deutschland-Hessen-Frankfurt-am-Main-Roemerberg.jpg,"Wenn funkelnde Lichter die Ufer des Rheins erhellen und festliche Stimmung Städte wie Koblenz, Mainz, Frankfurt und Bonn verzaubert, beginnt Ihre besondere Weihnachtsreise. An Bord von A-ROSA SILVA genießen Sie Heiligabend auf dem Fluss – begleitet von kulinarischem Genuss, Premium alles inklusive und einer Atmosphäre voller Wärme, Lichterglanz und unvergesslicher Festmomente.",,729.00,"Berge & Meer",10990,,,https://images2.productserve.com/?w=200&h=200&bg=white&trim=5&t=letterbox&url=ssl%3Ad13d0f5of5vzfo.cloudfront.net%2Fimages%2Fproducts%2F8a0092ff9db84e8c019db9c3d0d84591%2Flarge_8a0092ff9db84e8c019db946e25c65dd-Deutschland-Hessen-Frankfurt-am-Main-Roemerberg.jpg&feedId=115640&k=400b0dc608b1cbdfe2ffa761465ab19225f0254d,EUR,,,https://www.berge-meer.de/angebote/rhein-main-weihnachtskreuzfahrt-mit-a-rosa-silva-ab-an-koeln,,,EUR729.00,115640
https://www.awin1.com/pclick.php?p=44865574264&a=2914133&m=10990,"Island & Neuengland - Kreuzfahrt mit AIDAluna ab/an New York City inkl. 3 Nächte Vorprogramm in Reykjavík",44865574264,8a0092ff9dbd74ed019dbe4f6b8b4fb9,https://d13d0f5of5vzfo.cloudfront.net/images/products/8a0092ff9dbd74ed019dbe4f6b8b4fb9/large_8a0092ff99a2e3970199a46aad0521c7-USA-New-York-Central-Park.jpg,"Vom mystischen Reykjavík bis in die pulsierende Welt von New York City: Diese Reise hebt die klassische Neuengland-Route auf ein neues Level. Statt direkt an Bord zu gehen, beginnt das Erlebnis in Islands spektakulärer Natur. Heiße Quellen, Lavafelder und nordische Weite treffen auf den Indian Summer und die Küsten Neuenglands - intensiver und außergewöhnlicher lässt sich diese Route kaum erleben.",,3199.00,"Berge & Meer",10990,,,https://images2.productserve.com/?w=200&h=200&bg=white&trim=5&t=letterbox&url=ssl%3Ad13d0f5of5vzfo.cloudfront.net%2Fimages%2Fproducts%2F8a0092ff9dbd74ed019dbe4f6b8b4fb9%2Flarge_8a0092ff99a2e3970199a46aad0521c7-USA-New-York-Central-Park.jpg&feedId=115640&k=84debcc11c31db1c03fa439f58861569a4e49f0d,EUR,,,https://www.berge-meer.de/angebote/island-neuengland-kreuzfahrt-mit-aidaluna-ab-an-new-york-city-inkl-3-naechte-vorprogramm-in-reykjavik,,,EUR3199.00,115640
https://www.awin1.com/pclick.php?p=44865574265&a=2914133&m=10990,"Weltkreuzfahrt - Kreuzfahrt mit Costa Deliziosa ab/an Barcelona inkl. Flüge ab/an Frankfurt",44865574265,8a0092ff9dbd74ed019dbe992c903476,https://d13d0f5of5vzfo.cloudfront.net/images/products/8a0092ff9dbd74ed019dbe992c903476/large_8a0092fd50421d2e015042ded92c305c-Costa-Kreuzfahrten-Costa-Deliziosa.jpg,"Einmal um die Welt, unzählige Gänsehautmomente: Diese einmalige Kreuzfahrt vereint pulsierende Metropolen, tropische Inselträume und fremde Kulturen zu einem großen Ganzen. Von den Skylines Amerikas über die Südsee bis nach Asien erleben Sie die Vielfalt unseres Planeten in ihrer schönsten Form - entspannt, stilvoll und mit zahlreichen Inklusivleistungen, die diese Weltreise so besonders machen.",,19499.00,"Berge & Meer",10990,,,https://images2.productserve.com/?w=200&h=200&bg=white&trim=5&t=letterbox&url=ssl%3Ad13d0f5of5vzfo.cloudfront.net%2Fimages%2Fproducts%2F8a0092ff9dbd74ed019dbe992c903476%2Flarge_8a0092fd50421d2e015042ded92c305c-Costa-Kreuzfahrten-Costa-Deliziosa.jpg&feedId=115640&k=7b9746f889a962fa303d0343546d698954b43506,EUR,,,https://www.berge-meer.de/angebote/weltkreuzfahrt-kreuzfahrt-mit-costa-deliziosa-ab-an-barcelona-inkl-fluege-ab-an-frankfurt,,,EUR19499.00,115640
https://www.awin1.com/pclick.php?p=44865574266&a=2914133&m=10990,"Weltkreuzfahrt - Kreuzfahrt mit Costa Deliziosa ab/an Barcelona inkl. Flüge ab/an München",44865574266,8a0092ff9dbd74ed019dbe9a93fc7a38,https://d13d0f5of5vzfo.cloudfront.net/images/products/8a0092ff9dbd74ed019dbe9a93fc7a38/large_8a0092ff9588889401958a594d2129ef-USA-Kalifornien-Los-Angeles-Silvesterfeuerwerk.jpg,"Einmal um die Welt, unzählige Gänsehautmomente: Diese einmalige Kreuzfahrt vereint pulsierende Metropolen, tropische Inselträume und fremde Kulturen zu einem großen Ganzen. Von den Skylines Amerikas über die Südsee bis nach Asien erleben Sie die Vielfalt unseres Planeten in ihrer schönsten Form - entspannt, stilvoll und mit zahlreichen Inklusivleistungen, die diese Weltreise so besonders machen.",,19499.00,"Berge & Meer",10990,,,https://images2.productserve.com/?w=200&h=200&bg=white&trim=5&t=letterbox&url=ssl%3Ad13d0f5of5vzfo.cloudfront.net%2Fimages%2Fproducts%2F8a0092ff9dbd74ed019dbe9a93fc7a38%2Flarge_8a0092ff9588889401958a594d2129ef-USA-Kalifornien-Los-Angeles-Silvesterfeuerwerk.jpg&feedId=115640&k=4c432bbb04924fd24fa60749464d9e94c961fe49,EUR,,,https://www.berge-meer.de/angebote/weltkreuzfahrt-kreuzfahrt-mit-costa-deliziosa-ab-an-barcelona-inkl-fluege-ab-an-muenchen,,,EUR19499.00,115640
https://www.awin1.com/pclick.php?p=44865574267&a=2914133&m=10990,"Westliches Mittelmeer - Kreuzfahrt mit Costa Diadema ab/an Savona",44865574267,8a0092ff9df61a4c019df7af69217719,https://d13d0f5of5vzfo.cloudfront.net/images/products/8a0092ff9df61a4c019df7af69217719/large_8a0092ff5e524dfd015e9a114ec3640b-Costa-Kreuzfahrten-Costa-Diadema.jpg,"Mediterrane Lebensfreude trifft auf die Weite des Atlantiks: Diese außergewöhnliche Route verbindet Spaniens schönste Küstenstädte mit Lissabons besonderem Charme und dem markanten Felsen von Gibraltar. Zwischen Mittelmeer und Atlantik erleben Sie kulturelle Vielfalt, sonnige Landschaften und intensive Reiseeindrücke - entspannt und stilvoll an Bord der Costa Diadema.",,999.00,"Berge & Meer",10990,,,https://images2.productserve.com/?w=200&h=200&bg=white&trim=5&t=letterbox&url=ssl%3Ad13d0f5of5vzfo.cloudfront.net%2Fimages%2Fproducts%2F8a0092ff9df61a4c019df7af69217719%2Flarge_8a0092ff5e524dfd015e9a114ec3640b-Costa-Kreuzfahrten-Costa-Diadema.jpg&feedId=115640&k=c5b3aa6f5d767161227fe35f743712f8252df680,EUR,,,https://www.berge-meer.de/angebote/westliches-mittelmeer-kreuzfahrt-mit-costa-diadema-ab-an-savona-2,,,EUR999.00,115640
https://www.awin1.com/pclick.php?p=44865574268&a=2914133&m=10990,"Niederlande - Maas - Flusskreuzfahrt mit Rad & Schiff MS Poseidon ab/an Arnheim",44865574268,8a0092ff9e058dd8019e067aa6fe751b,https://d13d0f5of5vzfo.cloudfront.net/images/products/8a0092ff9e058dd8019e067aa6fe751b/large_8a0092ff9e006778019e02833ba830eb-Niederlande--Provinz-Limburg--Roermond--Fluss--Roer--Stadt--Kathedrale.jpg,"Die Maas entfaltet auf dieser Route ihren ganzen Charme: Genießen Sie Ihre Radtouren im eigenen Tempo entlang stiller Uferwege, durch grüne Nationalparks und idyllische Hafenorte. Während die MS Poseidon entspannt durch Limburg gleitet, verbinden sich aktive Erholung, genussvolle Stunden an Bord und die burgundische Atmosphäre von Maastricht und Roermond zu einem stimmungsvollen Reiseerlebnis.",,599.00,"Berge & Meer",10990,,,https://images2.productserve.com/?w=200&h=200&bg=white&trim=5&t=letterbox&url=ssl%3Ad13d0f5of5vzfo.cloudfront.net%2Fimages%2Fproducts%2F8a0092ff9e058dd8019e067aa6fe751b%2Flarge_8a0092ff9e006778019e02833ba830eb-Niederlande--Provinz-Limburg--Roermond--Fluss--Roer--Stadt--Kathedrale.jpg&feedId=115640&k=3902556d00d96ba5657e85a7223e0212ecaccb30,EUR,,,https://www.berge-meer.de/angebote/niederlande-maas-flusskreuzfahrt-mit-rad-schiff-ms-poseidon-ab-an-arnheim,,,EUR599.00,115640
