aw_deep_link,product_name,aw_product_id,merchant_product_id,merchant_image_url,description,merchant_category,search_price,merchant_name,merchant_id,category_name,category_id,aw_image_url,currency,store_price,delivery_cost,merchant_deep_link,language,last_updated,display_price,data_feed_id
https://www.awin1.com/pclick.php?p=44865574289&a=2914133&m=10990,"Mauritius, Transafrika & Spanien - Kreuzfahrt mit AIDAstella von Mauritius über Afrika bis Palma de Mallorca inkl. 3 Nächte Mauritius",44865574289,8a0092ff9cdb1404019cdc16dd2c64b0,https://d13d0f5of5vzfo.cloudfront.net/images/products/8a0092ff9cdb1404019cdc16dd2c64b0/large_8a0092ff67bf6d7f0167cac1863f2b0d-Mauritius-Strand.jpg,"Vom Paradies des Indischen Ozeans bis in die Sonne Mallorcas: Diese außergewöhnliche Kreuzfahrt verbindet europäische Küsten, afrikanische Entdeckungen und tropische Inselwelten zu einer Reise voller Kontraste. Erleben Sie 28 Nächte Genuss, Entspannung und Vielfalt an Bord von AIDAstella, gekrönt von drei erholsamen Nächten im Strandhotel auf Mauritius.",,2999.00,"Berge & Meer",10990,,,https://images2.productserve.com/?w=200&h=200&bg=white&trim=5&t=letterbox&url=ssl%3Ad13d0f5of5vzfo.cloudfront.net%2Fimages%2Fproducts%2F8a0092ff9cdb1404019cdc16dd2c64b0%2Flarge_8a0092ff67bf6d7f0167cac1863f2b0d-Mauritius-Strand.jpg&feedId=115640&k=a12d60c586d5ba2981859682f6314ba869489c94,EUR,,,https://www.berge-meer.de/angebote/mauritius-transafrika-spanien-kreuzfahrt-mit-aidastella-von-mauritius-ueber-afrika-bis-palma-de-mallorca-inkl-3-naechte-mauritius,,,EUR2999.00,115640
https://www.awin1.com/pclick.php?p=44865574290&a=2914133&m=10990,"Rhein - Niederlande - Kurz-Flusskreuzfahrt mit A-ROSA BRAVA ab/an Köln",44865574290,8a0092ff9d6b0f09019d6bcec91d7f97,https://d13d0f5of5vzfo.cloudfront.net/images/products/8a0092ff9d6b0f09019d6bcec91d7f97/large_8a0092ff91d9e5ec0191dabe5109560d-Niederlande-Rotterdam-Skyline.jpg,"Kleiner Urlaub mit großer Wirkung - neben erstklassigem Service an Bord und purem Genuss dank Premium alles inklusive gibt es auf Ihrem Kurztrip viel zu entdecken. Genießen Sie die Hafenatmosphäre in Rotterdam, das charmante Huizen am IJsselmeer und flanieren Sie in Emmerich entlang der Rheinpromenade mit Blick auf die imposante Rheinbrücke, Deutschlands längste Hängebrücke.",,649.00,"Berge & Meer",10990,,,https://images2.productserve.com/?w=200&h=200&bg=white&trim=5&t=letterbox&url=ssl%3Ad13d0f5of5vzfo.cloudfront.net%2Fimages%2Fproducts%2F8a0092ff9d6b0f09019d6bcec91d7f97%2Flarge_8a0092ff91d9e5ec0191dabe5109560d-Niederlande-Rotterdam-Skyline.jpg&feedId=115640&k=98b9df33e12f753d6d2407fc659ec4a087d6e936,EUR,,,https://www.berge-meer.de/angebote/rhein-niederlande-kurz-flusskreuzfahrt-mit-a-rosa-brava-ab-an-koeln,,,EUR649.00,115640
https://www.awin1.com/pclick.php?p=44865574291&a=2914133&m=10990,"Ost-/Westkanada & Alaska - Kreuzfahrt mit Nieuw Amsterdam von Vancouver bis Whittier inkl. großer Kanada-Rundreise und Denali Nationalpark",44865574291,8a0092ff9d703568019d71a627b90776,https://d13d0f5of5vzfo.cloudfront.net/images/products/8a0092ff9d703568019d71a627b90776/large_8a0092ff99db898a0199dc6332954378-Holland-American-Line-MS-Nieuw-Amsterdam.jpg,"Von den donnernden Niagarafällen über die Metropolen Ostkanadas bis in die Rocky Mountains und weiter durch Alaskas spektakuläre Gletscherwelt - diese Reise ist ein Nordamerika-Erlebnis der Extraklasse. An Bord der stilvollen Nieuw Amsterdam genießen Sie höchsten Komfort auf See. Zum krönenden Abschluss wartet die Wildnis des Denali Nationalparks mit Panoramazug und einmaligen Naturerlebnissen.",,6599.00,"Berge & Meer",10990,,,https://images2.productserve.com/?w=200&h=200&bg=white&trim=5&t=letterbox&url=ssl%3Ad13d0f5of5vzfo.cloudfront.net%2Fimages%2Fproducts%2F8a0092ff9d703568019d71a627b90776%2Flarge_8a0092ff99db898a0199dc6332954378-Holland-American-Line-MS-Nieuw-Amsterdam.jpg&feedId=115640&k=08239dd7621a288809a9c3df7892ebb9d551d841,EUR,,,https://www.berge-meer.de/angebote/ost-westkanada-alaska-kreuzfahrt-mit-nieuw-amsterdam-von-vancouver-bis-whittier-inkl-kanada-rundreise-und-denali-nationalpark,,,EUR6599.00,115640
https://www.awin1.com/pclick.php?p=44865574292&a=2914133&m=10990,"Donau - Flusskreuzfahrt mit MS Rousse Prestige ab/an Passau",44865574292,8a0092ff9d703568019d724adfe22f9a,https://d13d0f5of5vzfo.cloudfront.net/images/products/8a0092ff9d703568019d724adfe22f9a/large_8a0092ff9d4c2863019d4e0ff7314584-MS-Rousse-Prestige.jpg,"Mit MS Rousse Prestige zu historischen Hauptstädten, malerischen Landschaften und kulturellen Highlights an der Donau: Erleben Sie Wien, Budapest und Bratislava sowie Dürnstein und Melk in der Wachau. Egal, zu welcher Jahreszeit Sie reisen - im Sommer genießen Sie sonnige Tage und herrliche Panoramen und im Winter locken Weihnachtsmärkte und eine zauberhafte Donau-Atmosphäre im festlichen Glanz.",,1399.00,"Berge & Meer",10990,,,https://images2.productserve.com/?w=200&h=200&bg=white&trim=5&t=letterbox&url=ssl%3Ad13d0f5of5vzfo.cloudfront.net%2Fimages%2Fproducts%2F8a0092ff9d703568019d724adfe22f9a%2Flarge_8a0092ff9d4c2863019d4e0ff7314584-MS-Rousse-Prestige.jpg&feedId=115640&k=7cb29995433873a408f8849aba7e229ff2934e1a,EUR,,,https://www.berge-meer.de/angebote/donau-flusskreuzfahrt-mit-ms-rousse-prestige-ab-an-passau-3,,,EUR1399.00,115640
https://www.awin1.com/pclick.php?p=44865574293&a=2914133&m=10990,"Ostsee - Baltikum & Skandinavien - Kreuzfahrt mit der VASCO DA GAMA ab/an Kiel",44865574293,8a0092ff9d84cede019d8620bffe3019,https://d13d0f5of5vzfo.cloudfront.net/images/products/8a0092ff9d84cede019d8620bffe3019/large_8a0092ff8ea1ec79018ea37642a912d2-Schweden-Stockholm.jpg,"Tauchen Sie ein in die baltische und skandinavische Kultur und freuen Sie sich auf historische Hafenstädte entlang der Ostseeküste in Schweden, Dänemark, Polen, Finnland, Estland, Litauen und Lettland. Ab Kiel lernen Sie die europäischen Hauptstädte Kopenhagen, Stockholm, Helsinki, Tallinn und Riga kennen sowie spannende Orte wie Klaipėda, Gdynia, Rønne und - je nach Route - Kalmar oder Visby.",,2399.00,"Berge & Meer",10990,,,https://images2.productserve.com/?w=200&h=200&bg=white&trim=5&t=letterbox&url=ssl%3Ad13d0f5of5vzfo.cloudfront.net%2Fimages%2Fproducts%2F8a0092ff9d84cede019d8620bffe3019%2Flarge_8a0092ff8ea1ec79018ea37642a912d2-Schweden-Stockholm.jpg&feedId=115640&k=1020e29ae647d81b4b3333eec52ef2ad4e599141,EUR,,,https://www.berge-meer.de/angebote/ostsee-baltikum-skandinavien-kreuzfahrt-mit-der-vasco-da-gama-ab-an-kiel,,,EUR2399.00,115640
https://www.awin1.com/pclick.php?p=44865574294&a=2914133&m=10990,"Rhein - Deutschland & Frankreich - Flusskreuzfahrt mit der RHEIN SYMPHONIE ab/an Köln",44865574294,8a0092ff9da8db65019daac0e8cc1e72,https://d13d0f5of5vzfo.cloudfront.net/images/products/8a0092ff9da8db65019daac0e8cc1e72/large_8a0092ff6e844399016f1986d73a2750-nicko-cruises-Flussreisen-GmbH-MS-Rhein-Symphonie.jpg,"Entdecken Sie an Bord der RHEIN SYMPHONIE die Vielfalt des Rheins mit Kultur und Natur: Nach dem Start in Köln besuchen Sie Düsseldorf mit seiner eleganten Rheinpromenade, Koblenz am Deutschen Eck und das historische Mainz. In Mannheim trifft Barock auf Moderne, während Straßburg mit Fachwerk und europäischem Flair begeistert. Je nach Route erwartet Sie außerdem Germersheim oder Ludwigshafen.",,999.00,"Berge & Meer",10990,,,https://images2.productserve.com/?w=200&h=200&bg=white&trim=5&t=letterbox&url=ssl%3Ad13d0f5of5vzfo.cloudfront.net%2Fimages%2Fproducts%2F8a0092ff9da8db65019daac0e8cc1e72%2Flarge_8a0092ff6e844399016f1986d73a2750-nicko-cruises-Flussreisen-GmbH-MS-Rhein-Symphonie.jpg&feedId=115640&k=e38c2de95b317b8898484f6154f59283b4cf9711,EUR,,,https://www.berge-meer.de/angebote/rhein-deutschland-frankreich-flusskreuzfahrt-mit-der-rhein-symphonie-ab-an-koeln,,,EUR999.00,115640
https://www.awin1.com/pclick.php?p=44865574295&a=2914133&m=10990,"Rhein & Main - Advents-Flusskreuzfahrt mit A-ROSA BRAVA ab/an Köln",44865574295,8a0092ff9db84e8c019db977c41d213f,https://d13d0f5of5vzfo.cloudfront.net/images/products/8a0092ff9db84e8c019db977c41d213f/large_8a0092ff9abe5847019abfe2121300d2-Weihnachtsmarkt.jpg,"Wenn Lichterglanz die Ufer von Rhein und Main erhellt, Glühweinduft durch Köln, Rüdesheim, Mainz, Frankfurt und Koblenz zieht und festlich geschmückte Weihnachtsmärkte zum Verweilen einladen, beginnt Ihre besondere Adventsauszeit. An Bord von A-ROSA BRAVA genießen Sie vier Nächte mit Premium alles inklusive, stilvollem Komfort und winterlicher Flussromantik voller unvergesslicher Genussmomente.",,679.00,"Berge & Meer",10990,,,https://images2.productserve.com/?w=200&h=200&bg=white&trim=5&t=letterbox&url=ssl%3Ad13d0f5of5vzfo.cloudfront.net%2Fimages%2Fproducts%2F8a0092ff9db84e8c019db977c41d213f%2Flarge_8a0092ff9abe5847019abfe2121300d2-Weihnachtsmarkt.jpg&feedId=115640&k=476e92e311c20eebe38b8513904a8efe5eafdb3b,EUR,,,https://www.berge-meer.de/angebote/rhein-main-adventskreuzfahrt-mit-a-rosa-brava-ab-an-koeln,,,EUR679.00,115640
https://www.awin1.com/pclick.php?p=44865574296&a=2914133&m=10990,"Kanaren & Madeira - Kreuzfahrt mit AIDAcosma ab/an Santa Cruz de Tenerife inkl. 7 Nächte Hotel",44865574296,8a0092ff9dbd74ed019dc02519ed7b71,https://d13d0f5of5vzfo.cloudfront.net/images/products/8a0092ff9dbd74ed019dc02519ed7b71/large_8a0092ff69ffff28016a0be549d65a55-Santa-Cruz-de-Tenerife.jpg,"Lust auf Sonne, Meer und unvergessliche Erlebnisse? Verbringen Sie traumhafte Tage auf dem Atlantik mit AIDAcosma! Entdecken Sie die faszinierende Vielfalt der Kanarischen Inseln, schlendern Sie durch Madeiras Blütenpracht und genießen Sie nach der Kreuzfahrt eine Woche lang pure Erholung im 4-Sterne-All Inclusive-Hotel auf Teneriffa. Die perfekte Kombination für Ihre wohlverdiente Auszeit.",,1886.00,"Berge & Meer",10990,,,https://images2.productserve.com/?w=200&h=200&bg=white&trim=5&t=letterbox&url=ssl%3Ad13d0f5of5vzfo.cloudfront.net%2Fimages%2Fproducts%2F8a0092ff9dbd74ed019dc02519ed7b71%2Flarge_8a0092ff69ffff28016a0be549d65a55-Santa-Cruz-de-Tenerife.jpg&feedId=115640&k=5751fcf24e44b7cb9807a2ffdab5bcbec2b8ba28,EUR,,,https://www.berge-meer.de/angebote/kanaren-madeira-kreuzfahrt-mit-aidacosma-ab-an-santa-cruz-de-tenerife-inkl-7-naechte-hotel,,,EUR1886.00,115640
https://www.awin1.com/pclick.php?p=44865574297&a=2914133&m=10990,"Italien & Adria - Mini-Kreuzfahrt mit Costa Deliziosa von Civitavecchia bis Venedig inkl. Rom- & Venedig-Städteprogramm",44865574297,8a0092ff9ddc5b13019ddddbc2f000e0,https://d13d0f5of5vzfo.cloudfront.net/images/products/8a0092ff9ddc5b13019ddddbc2f000e0/large_8a0092ff6ffc28d601702f491d850109-Italien-Venetien-Venedig.jpg,"Diese Reise verbindet Städteurlaub und Kreuzfahrt zu einem stimmigen Gesamterlebnis: Zu Beginn stehen zwei Nächte in Rom mit Stadtrundfahrt zu den barocken Highlights auf dem Plan. Dazwischen genießen Sie eine Adria-Mini-Kreuzfahrt an Bord der Costa Deliziosa mit Stopps in Bari und auf Korfu. Den Abschluss bildet eine Übernachtung bei Venedig inklusive Stadtrundgang durch die Lagunenstadt.",,999.00,"Berge & Meer",10990,,,https://images2.productserve.com/?w=200&h=200&bg=white&trim=5&t=letterbox&url=ssl%3Ad13d0f5of5vzfo.cloudfront.net%2Fimages%2Fproducts%2F8a0092ff9ddc5b13019ddddbc2f000e0%2Flarge_8a0092ff6ffc28d601702f491d850109-Italien-Venetien-Venedig.jpg&feedId=115640&k=d3ed30b3554c04e3c961c005f3f00573d84a0d62,EUR,,,https://www.berge-meer.de/angebote/italien-adria-mini-kreuzfahrt-mit-costa-deliziosa-von-civitavecchia-bis-venedig-inkl-rom-venedig-staedteprogramm,,,EUR999.00,115640
https://www.awin1.com/pclick.php?p=44865574298&a=2914133&m=10990,"Östliches Mittelmeer - Kreuzfahrt mit der Celestyal Journey ab/an Piräus inkl. 2 Nächte in Athen",44865574298,8a0092ff9ddc5b13019ddef11cba6ca0,https://d13d0f5of5vzfo.cloudfront.net/images/products/8a0092ff9ddc5b13019ddef11cba6ca0/large_8a0092ff906c426101906e2ff4270548-Celestyal-Journey.jpg,"Starten Sie mit zwei Nächten in Athen, wo Antike und lebendiges Stadtleben aufeinandertreffen, bevor Sie an Bord der Celestyal Journey die Ägäis und die Adria erkunden. Die Route verbindet griechische Inseln wie Santorini, Mykonos, Kreta und Rhodos mit kulturellen und historischen Höhepunkten wie Kuşadası, Dubrovnik und Bari. Eine Kreuzfahrt zwischen mediterranem Flair, Inselwelten und Geschichte.",,2799.00,"Berge & Meer",10990,,,https://images2.productserve.com/?w=200&h=200&bg=white&trim=5&t=letterbox&url=ssl%3Ad13d0f5of5vzfo.cloudfront.net%2Fimages%2Fproducts%2F8a0092ff9ddc5b13019ddef11cba6ca0%2Flarge_8a0092ff906c426101906e2ff4270548-Celestyal-Journey.jpg&feedId=115640&k=a318145740be6dabf7f7959e61643a12957524ce,EUR,,,https://www.berge-meer.de/angebote/oestliches-mittelmeer-kreuzfahrt-mit-der-celestyal-journey-ab-an-piraeus-inkl-2-naechte-in-athen,,,EUR2799.00,115640
https://www.awin1.com/pclick.php?p=44865574299&a=2914133&m=10990,"Rhein, Main & Neckar - Rad & Schiff Flusskreuzfahrt mit MS Casavona von Frankfurt am Main bis Bad Cannstatt/Stuttgart",44865574299,8a0092ff9df61a4c019df7e42e142cb6,https://d13d0f5of5vzfo.cloudfront.net/images/products/8a0092ff9df61a4c019df7e42e142cb6/large_8a0092ff8dd42502018dd6952c111364-Deutschland-Heidelberg-Panoramablick.jpg,"Von der Skyline Frankfurts radeln und kreuzen Sie hinein in die stillen Schleifen des Neckars bis zu den Weinbergen rund um Stuttgart. Auf dieser Reise zeigt sich die ganze Vielfalt von Rhein, Main und Neckar. Fachwerkorte, Burgen und Weinberge prägen die Landschaft. Aktiv auf dem Rad und entspannt an Bord der MS Casanova verbindet die Tour Bewegung und Komfort auf besonders stimmige Weise.",,1499.00,"Berge & Meer",10990,,,https://images2.productserve.com/?w=200&h=200&bg=white&trim=5&t=letterbox&url=ssl%3Ad13d0f5of5vzfo.cloudfront.net%2Fimages%2Fproducts%2F8a0092ff9df61a4c019df7e42e142cb6%2Flarge_8a0092ff8dd42502018dd6952c111364-Deutschland-Heidelberg-Panoramablick.jpg&feedId=115640&k=5f25838bdbaf521e400490cd08cf5a1596205310,EUR,,,https://www.berge-meer.de/angebote/rhein-main-neckar-rad-schiff-flusskreuzfahrt-mit-ms-casavona-von-frankfurt-am-main-bis-bad-cannstatt-stuttgart,,,EUR1499.00,115640
https://www.awin1.com/pclick.php?p=44865574300&a=2914133&m=10990,"Norwegen - Nordkap - Seereise mit Hurtigruten MS Nordkapp/MS Polarlys ab/an Bergen",44865574300,8a0092ff9e150100019e16a8852943b5,https://d13d0f5of5vzfo.cloudfront.net/images/products/8a0092ff9e150100019e16a8852943b5/large_8a0092ff8648f42b01864b20715827ce-Hurtigruten-MS-Polarys.JPG,"Vorbei an tiefen Fjorden, zerklüfteten Inselwelten und bunten Küstenorten folgt diese Hurtigruten-Reise der legendären Postschiffroute bis ans legendäre Nordkap. Zwischen Bergen, Tromsø und Kirkenes ziehen spektakuläre Landschaften vorbei, während das arktische Licht die Küste verzaubert. Höhepunkt ist der bereits inkludierte Ausflug zum berühmten Globus des Nordkaps hoch über dem Eismeer.",,2799.00,"Berge & Meer",10990,,,https://images2.productserve.com/?w=200&h=200&bg=white&trim=5&t=letterbox&url=ssl%3Ad13d0f5of5vzfo.cloudfront.net%2Fimages%2Fproducts%2F8a0092ff9e150100019e16a8852943b5%2Flarge_8a0092ff8648f42b01864b20715827ce-Hurtigruten-MS-Polarys.JPG&feedId=115640&k=a971cb4dab203e63824cd505a3573ad45e669413,EUR,,,https://www.berge-meer.de/angebote/norwegen-nordkap-seereise-mit-hurtigruten-ms-nordkapp-ms-polarlys-ab-an-bergen,,,EUR2799.00,115640
https://www.awin1.com/pclick.php?p=44865574302&a=2914133&m=10990,"USA, Kanada & Mittelamerika - Kreuzfahrt mit der Island Princess von Los Angeles bis Fort Lauderdale inkl. USA-Rundreise von New York City bis Los Angeles",44865574302,8a0092ff9e1f4dc4019e21ca2b994dc6,https://d13d0f5of5vzfo.cloudfront.net/images/products/8a0092ff9e1f4dc4019e21ca2b994dc6/large_8a0092ff8e5a0a4f018e5ca1f46106f5-USA-Kalifornien-San-Francisco-Golden-Gate-Bridge.jpg,"Von der Skyline New York Citys bis zu karibischen Stränden und der Exotik Mittelamerikas: Zuerst reisen Sie quer durch die USA und erkunden pulsierende Metropolen, imposante Naturphänomene wie die Niagarafälle und spektakuläre Nationalparks. Mit der Island Princess erleben Sie dann eine facettenreiche Kreuzfahrt mit Kultur, tropischem Flair und der Vielfalt zwischen der Karibik und Mittelamerika.",,7399.00,"Berge & Meer",10990,,,https://images2.productserve.com/?w=200&h=200&bg=white&trim=5&t=letterbox&url=ssl%3Ad13d0f5of5vzfo.cloudfront.net%2Fimages%2Fproducts%2F8a0092ff9e1f4dc4019e21ca2b994dc6%2Flarge_8a0092ff8e5a0a4f018e5ca1f46106f5-USA-Kalifornien-San-Francisco-Golden-Gate-Bridge.jpg&feedId=115640&k=a125f3d63701c9eb72595b4bd2a935f5d43b3703,EUR,,,https://www.berge-meer.de/angebote/usa-kanada-mittelamerika-kreuzfahrt-mit-der-island-princess-von-los-angeles-bis-fort-lauderdale-inkl-usa-rundreise-von-new-york-city-bis-los-angeles,,,EUR7399.00,115640
https://www.awin1.com/pclick.php?p=44865574303&a=2914133&m=10990,"Island & Schottland - Kreuzfahrt mit der MSC Preziosa ab/an Hamburg",44865574303,8a0092ff9e4da6fd019e4efb963b36c9,https://d13d0f5of5vzfo.cloudfront.net/images/products/8a0092ff9e4da6fd019e4efb963b36c9/large_8a0092ff69dbf2130169dd0a67c24ad2-MSC-Kreuzfahrten-MSC-Preziosa.jpg,"Die Vielfalt Islands ab Hamburg: Weite Fjordlandschaften, tosende Wasserfälle und Städte wie Reykjavík, Akureyri und Ísafjörður erwarten Sie auf der Insel aus Feuer und Eis. Am Rand der Nordsee warten außerdem die schottischen Shetland und Orkney Inseln darauf, erkundet zu werden. Je nach Route besuchen Sie zudem Invergordon und South Queensferry in Schottland sowie das isländische Seyðisfjörður.",,1699.00,"Berge & Meer",10990,,,https://images2.productserve.com/?w=200&h=200&bg=white&trim=5&t=letterbox&url=ssl%3Ad13d0f5of5vzfo.cloudfront.net%2Fimages%2Fproducts%2F8a0092ff9e4da6fd019e4efb963b36c9%2Flarge_8a0092ff69dbf2130169dd0a67c24ad2-MSC-Kreuzfahrten-MSC-Preziosa.jpg&feedId=115640&k=b25f5a9a72ba6ee10dd77828a4158651bc2ad057,EUR,,,https://www.berge-meer.de/angebote/island-schottland-kreuzfahrt-mit-der-msc-preziosa-ab-an-hamburg,,,EUR1699.00,115640
https://www.awin1.com/pclick.php?p=44865574304&a=2914133&m=10990,"Westliches Mittelmeer - Kreuzfahrt mit der MSC Sinfonia inkl. Standortrundreise in Andalusien",44865574304,8a0092ff9e4da6fd019e4f4f2a8a7d43,https://d13d0f5of5vzfo.cloudfront.net/images/products/8a0092ff9e4da6fd019e4f4f2a8a7d43/large_8a0092ff951c630401951e1ab9267187-Portugal-Lissabon-Alfama-Stadt-Frau.jpg,"Andalusische Bilderbuchgassen, ein Abstecher nach Afrika und mediterrane Klassiker auf einer Reise: Von Estepona aus, dem ""Garten der Costa del Sol"", entdecken Sie Granada und Sevilla. Danach erkunden Sie mit der MSC Sinfonia abwechslungsreiche Küsten - von Marokkos Medina über Portugals Algarve bis zu Italiens Hafenstädten. Drei Routen mit maximaler Reisevielfalt - ohne ständiges Kofferpacken.",,2699.00,"Berge & Meer",10990,,,https://images2.productserve.com/?w=200&h=200&bg=white&trim=5&t=letterbox&url=ssl%3Ad13d0f5of5vzfo.cloudfront.net%2Fimages%2Fproducts%2F8a0092ff9e4da6fd019e4f4f2a8a7d43%2Flarge_8a0092ff951c630401951e1ab9267187-Portugal-Lissabon-Alfama-Stadt-Frau.jpg&feedId=115640&k=188e9b20d18ca7cc156788831d739a24e2e7e9e1,EUR,,,https://www.berge-meer.de/angebote/westliches-mittelmeer-kreuzfahrt-mit-der-msc-sinfonia-inkl-standortrundreise-in-andalusien,,,EUR2699.00,115640
https://www.awin1.com/pclick.php?p=44865574305&a=2914133&m=10990,"Südamerika & Antarktis - Kreuzfahrt mit Oosterdam von Buenos Aires bis Santiago de Chile",44865574305,8a0092ff9ab40bb3019ab4ff428369e2,https://d13d0f5of5vzfo.cloudfront.net/images/products/8a0092ff9ab40bb3019ab4ff428369e2/large_8a0092fd50421d2e015042fc47b05968-Holland-American-Line-MS-Oosterdam.jpg,"Erleben Sie große Expeditionsgefühle mit Komfort: An Bord der Oosterdam reisen Sie zwischen Buenos Aires und Santiago de Chile rund um das legendäre Kap Hoorn bis in die Antarktis - eine Welt aus Eisbergen, Pinguinen und stiller Majestät. Chilenische Fjorde, Ushuaia, die Falklandinseln & mehr erwarten Sie.",,5499.00,"Berge & Meer",10990,,,https://images2.productserve.com/?w=200&h=200&bg=white&trim=5&t=letterbox&url=ssl%3Ad13d0f5of5vzfo.cloudfront.net%2Fimages%2Fproducts%2F8a0092ff9ab40bb3019ab4ff428369e2%2Flarge_8a0092fd50421d2e015042fc47b05968-Holland-American-Line-MS-Oosterdam.jpg&feedId=115640&k=ba9f6407537b05bb5f3641af1617c26bae5b9aaf,EUR,,,https://www.berge-meer.de/angebote/suedamerika-antarktis-kreuzfahrt-mit-oosterdam-ab-buenos-aires-an-santiago-de-chile,,,EUR5499.00,115640
https://www.awin1.com/pclick.php?p=44865574306&a=2914133&m=10990,"Südamerika & Antarktis - Kreuzfahrt mit Oosterdam von Buenos Aires bis Santiago de Chile inkl. Brasilien- und Peru-Rundreise",44865574306,8a0092ff9ab40bb3019ab500593345a3,https://d13d0f5of5vzfo.cloudfront.net/images/products/8a0092ff9ab40bb3019ab500593345a3/large_8a0092ff6e844399016e8e815dd13b74-Rio-de-Janeiro-Cristo-Redentor.jpg,"Erleben Sie Expeditionsgefühle mit Komfort: Nach einer unvergesslichen Brasilien-Rundreise gehen Sie in Buenos Aires an Bord der Oosterdam und reisen rund um das legendäre Kap Hoorn bis in die Antarktis - eine Welt aus Eisbergen, Pinguinen und stiller Majestät. Chilenische Fjorde, Ushuaia, die Falklandinseln & mehr erwarten Sie, bevor Ihre Reise mit einer Peru-Rundreise ihren Abschluss findet.",,8999.00,"Berge & Meer",10990,,,https://images2.productserve.com/?w=200&h=200&bg=white&trim=5&t=letterbox&url=ssl%3Ad13d0f5of5vzfo.cloudfront.net%2Fimages%2Fproducts%2F8a0092ff9ab40bb3019ab500593345a3%2Flarge_8a0092ff6e844399016e8e815dd13b74-Rio-de-Janeiro-Cristo-Redentor.jpg&feedId=115640&k=6827b4de902c7971237134a6c5c537bc0e5a483c,EUR,,,https://www.berge-meer.de/angebote/suedamerika-antarktis-brasilien-rundreise-inkl-kreuzfahrt-mit-oosterdam-ab-buenos-aires-an-santiago-de-chile-peru-rundreise,,,EUR8999.00,115640
https://www.awin1.com/pclick.php?p=44865574307&a=2914133&m=10990,"Südamerika & Antarktis - Kreuzfahrt mit Oosterdam von Santiago de Chile bis Buenos Aires inkl. Peru- und Brasilien-Rundreise",44865574307,8a0092ff9ab40bb3019ab500b1c86f15,https://d13d0f5of5vzfo.cloudfront.net/images/products/8a0092ff9ab40bb3019ab500b1c86f15/large_8a0092ff6c1cba9d016c2e6235162f45-Machu-Picchu-Peru.jpg,"Erleben Sie Expeditionsgefühle mit Komfort: Nach einer Peru-Rundreise gehen Sie in Santiago de Chile an Bord der Oosterdam und reisen rund um das Kap Hoorn bis in die Antarktis - eine Welt aus Eisbergen, Pinguinen und stiller Majestät. Chilenische Fjorde, Ushuaia, die Falklandinseln & mehr erwarten Sie, bevor Ihre Reise in Buenos Aires endet und Sie anschließend Ihre Brasilien-Rundreise genießen.",,9499.00,"Berge & Meer",10990,,,https://images2.productserve.com/?w=200&h=200&bg=white&trim=5&t=letterbox&url=ssl%3Ad13d0f5of5vzfo.cloudfront.net%2Fimages%2Fproducts%2F8a0092ff9ab40bb3019ab500b1c86f15%2Flarge_8a0092ff6c1cba9d016c2e6235162f45-Machu-Picchu-Peru.jpg&feedId=115640&k=c9f95399b1f6761ca01def4aa2ae16079208c776,EUR,,,https://www.berge-meer.de/angebote/suedamerika-antarktis-peru-rundreise-inkl-kreuzfahrt-mit-oosterdam-ab-santiago-de-chile-an-buenos-aires-brasilien-rundreise,,,EUR9499.00,115640
https://www.awin1.com/pclick.php?p=44865574308&a=2914133&m=10990,"Südamerika - Kreuzfahrt mit der Majestic Princess von Buenos Aires bis Santiago de Chile",44865574308,8a0092ff9b014aef019b03983f352c65,https://d13d0f5of5vzfo.cloudfront.net/images/products/8a0092ff9b014aef019b03983f352c65/large_8a0092ff8c1e6869018c20359d766688-Falkinseln-Pinguine.jpg,"Erleben Sie eine Kreuzfahrt von Buenos Aires bis Santiago de Chile und die Vielfalt Südamerikas: Nach einer Nacht im lebendigen Buenos Aires besuchen Sie z. B. Montevideo, Puerto Madryn, die Falklandinseln und Ushuaia. Staunen Sie bei der Fahrt um das legendäre Kap Hoorn, durch den Beagle-Kanal und durch die Glacier Alley. Freuen Sie sich auf Gletscher, Pinguine und chilenische Lebensfreude!",,4399.00,"Berge & Meer",10990,,,https://images2.productserve.com/?w=200&h=200&bg=white&trim=5&t=letterbox&url=ssl%3Ad13d0f5of5vzfo.cloudfront.net%2Fimages%2Fproducts%2F8a0092ff9b014aef019b03983f352c65%2Flarge_8a0092ff8c1e6869018c20359d766688-Falkinseln-Pinguine.jpg&feedId=115640&k=7590ce515f68859d2fb83d366ab497393bea1cf6,EUR,,,https://www.berge-meer.de/angebote/suedamerika-kreuzfahrt-mit-der-majestic-princess-von-buenos-aires-bis-santiago-de-chile,,,EUR4399.00,115640
https://www.awin1.com/pclick.php?p=44865574309&a=2914133&m=10990,"Weltkreuzfahrt - Kreuzfahrt mit MS Hamburg ab/an Hamburg inkl. 1 Galanacht in Hamburg",44865574309,8a0092ff9b203118019b21cbd3242e61,https://d13d0f5of5vzfo.cloudfront.net/images/products/8a0092ff9b203118019b21cbd3242e61/large_8a0092ff9370f344019372afc41d4c22-Plantours-Kreuzfahrten-MS-Hamburg-Hamburg.jpg,"Erleben Sie das Abenteuer Weltreise mit MS Hamburg: Erkunden Sie exotische Inseln, pulsierende Städte und atemberaubende Naturwunder rund um den Globus. Entdecken Sie fremde Kulturen sowie abwechslungsreiche Landschaften und feiern Sie Silvester im brasilianischen Rio de Janeiro. An den erholsamen Seetagen genießen Sie die vielen Annehmlichkeiten Ihres komfortablen Kreuzfahrtschiffes.",,27999.00,"Berge & Meer",10990,,,https://images2.productserve.com/?w=200&h=200&bg=white&trim=5&t=letterbox&url=ssl%3Ad13d0f5of5vzfo.cloudfront.net%2Fimages%2Fproducts%2F8a0092ff9b203118019b21cbd3242e61%2Flarge_8a0092ff9370f344019372afc41d4c22-Plantours-Kreuzfahrten-MS-Hamburg-Hamburg.jpg&feedId=115640&k=aa566a1f92a8adc6cb579e78f475bc2b692e11b0,EUR,,,https://www.berge-meer.de/angebote/weltkreuzfahrt-kreuzfahrt-mit-ms-hamburg-ab-an-hamburg-inkl-1-galanacht-in-hamburg,,,EUR27999.00,115640
